number,value,datetime_start,datetime_complete,duration,params_FS Ratio,params_FS Tech,params_Model,params_OV Tech,params_Scaler,state
0,0.7358929342795328,2025-03-18 11:55:37.870827,2025-03-18 11:56:15.058739,0 days 00:00:37.187912,70,Chi2,ETs,,MinMax,COMPLETE
1,0.7537751874881468,2025-03-18 11:55:37.897288,2025-03-18 11:56:04.013521,0 days 00:00:26.116233,50,Chi2,AB,,MaxAbs,COMPLETE
2,0.7167520440764444,2025-03-18 11:55:38.804433,2025-03-18 11:56:27.225572,0 days 00:00:48.421139,50,PCA,DT,ADASYN,MaxAbs,COMPLETE
3,0.0,2025-03-18 11:55:38.927550,2025-03-18 11:56:09.425733,0 days 00:00:30.498183,10,RFE,ETs,SVMSMOTE,Robust,COMPLETE
4,0.0,2025-03-18 11:55:39.107854,2025-03-18 11:56:36.670441,0 days 00:00:57.562587,100,RF,SGD,SVMSMOTE,Robust,COMPLETE
5,0.7608185579543376,2025-03-18 11:55:39.208417,2025-03-18 11:56:32.760570,0 days 00:00:53.552153,50,PCA,KNN,SMOTE,MaxAbs,COMPLETE
6,0.698122694101299,2025-03-18 11:55:39.376416,2025-03-18 11:56:05.211574,0 days 00:00:25.835158,90,Chi2,RF,BorderlineSMOTE,,COMPLETE
7,0.6885753984984507,2025-03-18 11:55:39.521433,2025-03-18 11:56:15.058739,0 days 00:00:35.537306,20,LDA,SGD,,Normalizer,COMPLETE
8,0.7212535292066702,2025-03-18 11:55:39.649701,2025-03-18 11:56:13.704398,0 days 00:00:34.054697,30,ANOVA,AB,ADASYN,Normalizer,COMPLETE
9,0.7299802270605482,2025-03-18 11:55:39.819843,2025-03-18 11:56:27.470494,0 days 00:00:47.650651,80,PCA,ETs,,Standard,COMPLETE
10,0.7276705123006678,2025-03-18 11:55:39.966533,2025-03-18 11:56:09.345771,0 days 00:00:29.379238,40,,AB,,Standard,COMPLETE
11,0.0,2025-03-18 11:55:40.110842,2025-03-18 11:56:18.039446,0 days 00:00:37.928604,10,Chi2,RF,SVMSMOTE,MinMax,COMPLETE
12,0.7399947380654717,2025-03-18 11:55:40.281087,2025-03-18 11:56:15.394663,0 days 00:00:35.113576,50,MI,MLP,,MaxAbs,COMPLETE
13,0.7212535292066702,2025-03-18 11:55:40.393236,2025-03-18 11:56:23.197288,0 days 00:00:42.804052,30,RF,AB,SMOTE,,COMPLETE
14,0.0,2025-03-18 11:55:40.626684,2025-03-18 11:56:15.386664,0 days 00:00:34.759980,100,MI,SGD,,Normalizer,COMPLETE
15,0.0,2025-03-18 11:55:40.834211,2025-03-18 11:56:15.390663,0 days 00:00:34.556452,100,LDA,SGD,ADASYN,Robust,COMPLETE
16,0.7446288741511409,2025-03-18 11:55:41.013613,2025-03-18 11:56:18.970940,0 days 00:00:37.957327,40,MI,KNN,SVMSMOTE,Standard,COMPLETE
17,0.0,2025-03-18 11:55:41.177941,2025-03-18 11:56:08.373940,0 days 00:00:27.195999,30,LDA,RF,BorderlineSMOTE,QT,COMPLETE
18,0.0,2025-03-18 11:55:41.358412,2025-03-18 11:56:05.485451,0 days 00:00:24.127039,30,LDA,SGD,,Standard,COMPLETE
19,0.0,2025-03-18 11:55:41.470149,2025-03-18 11:56:19.990856,0 days 00:00:38.520707,100,RFE,DT,BorderlineSMOTE,Robust,COMPLETE
20,0.7432195783879092,2025-03-18 11:55:41.642442,2025-03-18 11:56:36.160920,0 days 00:00:54.518478,70,ANOVA,KNN,SMOTE,QT,COMPLETE
21,0.6950528993703926,2025-03-18 11:55:41.790459,2025-03-18 11:56:18.027446,0 days 00:00:36.236987,90,ANOVA,AB,SMOTE,MinMax,COMPLETE
22,0.7407186633849961,2025-03-18 11:55:41.978440,2025-03-18 11:56:06.060802,0 days 00:00:24.082362,30,MI,KNN,SMOTE,MinMax,COMPLETE
23,0.0,2025-03-18 11:55:42.182446,2025-03-18 11:56:21.391745,0 days 00:00:39.209299,10,PCA,SGD,BorderlineSMOTE,Standard,COMPLETE
24,0.0,2025-03-18 11:55:42.306443,2025-03-18 11:56:20.387348,0 days 00:00:38.080905,50,RF,RF,SVMSMOTE,Normalizer,COMPLETE
25,0.6974934140100701,2025-03-18 11:55:42.466442,2025-03-18 11:56:15.434636,0 days 00:00:32.968194,90,ANOVA,SGD,,MaxAbs,COMPLETE
26,0.7412031885283608,2025-03-18 11:55:42.622438,2025-03-18 11:56:23.434939,0 days 00:00:40.812501,40,ANOVA,AB,SMOTE,QT,COMPLETE
27,0.0,2025-03-18 11:55:42.814117,2025-03-18 11:56:33.160429,0 days 00:00:50.346312,80,RF,DT,SVMSMOTE,Standard,COMPLETE
28,0.0,2025-03-18 11:55:43.170873,2025-03-18 11:56:25.604998,0 days 00:00:42.434125,40,LDA,RF,ADASYN,Standard,COMPLETE
29,0.0,2025-03-18 11:55:43.339255,2025-03-18 11:56:19.669094,0 days 00:00:36.329839,50,Chi2,KNN,,Standard,COMPLETE
30,0.7397598456017949,2025-03-18 11:55:43.555415,2025-03-18 11:56:57.030655,0 days 00:01:13.475240,70,,KNN,,QT,COMPLETE
31,0.0,2025-03-18 11:55:43.767651,2025-03-18 11:56:26.412758,0 days 00:00:42.645107,80,RF,MLP,ADASYN,MinMax,COMPLETE
32,0.7718884024032163,2025-03-18 11:55:43.987804,2025-03-18 11:56:36.160920,0 days 00:00:52.173116,70,,KNN,SVMSMOTE,QT,COMPLETE
33,0.729517528432055,2025-03-18 11:55:44.432088,2025-03-18 11:56:39.370418,0 days 00:00:54.938330,80,,KNN,SVMSMOTE,MaxAbs,COMPLETE
34,0.7434663607421393,2025-03-18 11:55:44.764738,2025-03-18 11:56:35.870887,0 days 00:00:51.106149,60,PCA,DT,SVMSMOTE,Standard,COMPLETE
35,0.7198415961499791,2025-03-18 11:55:47.670318,2025-03-18 11:56:47.728611,0 days 00:01:00.058293,70,,KNN,,MaxAbs,COMPLETE
36,0.76493474356187,2025-03-18 11:55:47.929872,2025-03-18 11:57:05.996669,0 days 00:01:18.066797,70,,KNN,,MaxAbs,COMPLETE
37,0.0,2025-03-18 11:55:48.098279,2025-03-18 11:56:20.367348,0 days 00:00:32.269069,40,LDA,SGD,SMOTE,MinMax,COMPLETE
38,0.7397598456017949,2025-03-18 11:55:48.295693,2025-03-18 11:56:47.510741,0 days 00:00:59.215048,70,,KNN,,MaxAbs,COMPLETE
39,0.496238729293285,2025-03-18 11:55:48.534538,2025-03-18 11:56:23.963169,0 days 00:00:35.428631,70,MI,RF,SVMSMOTE,Normalizer,COMPLETE
40,0.7320602294604945,2025-03-18 11:55:48.686051,2025-03-18 11:56:51.528930,0 days 00:01:02.842879,60,,KNN,SVMSMOTE,MaxAbs,COMPLETE
41,0.7543340832587802,2025-03-18 11:55:48.807977,2025-03-18 11:56:22.766678,0 days 00:00:33.958701,70,,KNN,,MinMax,COMPLETE
42,0.7576446957394404,2025-03-18 11:55:48.988527,2025-03-18 11:57:16.725966,0 days 00:01:27.737439,70,Chi2,ETs,,QT,COMPLETE
43,0.7397598456017949,2025-03-18 11:55:49.204217,2025-03-18 11:56:57.020905,0 days 00:01:07.816688,70,,ETs,,MaxAbs,COMPLETE
44,0.7356855963054217,2025-03-18 11:55:58.952008,2025-03-18 11:56:46.180591,0 days 00:00:47.228583,80,,KNN,SVMSMOTE,MaxAbs,COMPLETE
45,0.7172254899287229,2025-03-18 11:56:02.471409,2025-03-18 11:56:47.775536,0 days 00:00:45.304127,60,,KNN,SVMSMOTE,MaxAbs,COMPLETE
46,0.7667563488302057,2025-03-18 11:56:02.660558,2025-03-18 11:56:48.185888,0 days 00:00:45.525330,60,,KNN,SVMSMOTE,MaxAbs,COMPLETE
47,0.7620207283643088,2025-03-18 11:56:02.660558,2025-03-18 11:56:46.720526,0 days 00:00:44.059968,60,,KNN,SVMSMOTE,MaxAbs,COMPLETE
48,0.7703143170087026,2025-03-18 11:56:04.942532,2025-03-18 11:56:53.295633,0 days 00:00:48.353101,70,,ETs,,MaxAbs,COMPLETE
49,0.7583027765638384,2025-03-18 11:56:08.936931,2025-03-18 11:56:54.160843,0 days 00:00:45.223912,70,,ETs,,MaxAbs,COMPLETE
50,0.7128894932527222,2025-03-18 11:56:09.229389,2025-03-18 11:56:38.300539,0 days 00:00:29.071150,60,,KNN,SVMSMOTE,Standard,COMPLETE
51,0.7048639153382411,2025-03-18 11:56:10.862659,2025-03-18 11:56:42.335324,0 days 00:00:31.472665,60,,KNN,SVMSMOTE,MaxAbs,COMPLETE
52,0.6942802629252435,2025-03-18 11:56:12.030405,2025-03-18 11:56:49.400903,0 days 00:00:37.370498,60,,KNN,SVMSMOTE,MaxAbs,COMPLETE
53,0.7257803968499283,2025-03-18 11:56:12.238545,2025-03-18 11:56:52.090537,0 days 00:00:39.851992,70,,KNN,,MaxAbs,COMPLETE
54,0.7635951790143308,2025-03-18 11:56:12.826613,2025-03-18 11:57:20.319782,0 days 00:01:07.493169,70,,KNN,SVMSMOTE,MaxAbs,COMPLETE
55,0.6456062106773858,2025-03-18 11:56:22.942110,2025-03-18 11:57:01.142542,0 days 00:00:38.200432,20,PCA,ETs,SMOTE,QT,COMPLETE
56,0.7399947380654717,2025-03-18 11:56:27.030582,2025-03-18 11:57:27.290435,0 days 00:01:00.259853,70,,ETs,,MaxAbs,COMPLETE
57,0.719568131476744,2025-03-18 11:56:27.350470,2025-03-18 11:57:33.035718,0 days 00:01:05.685248,50,RFE,ETs,BorderlineSMOTE,,COMPLETE
58,0.6624296229310069,2025-03-18 11:56:33.410840,2025-03-18 11:57:33.629445,0 days 00:01:00.218605,20,PCA,ETs,SMOTE,,COMPLETE
59,0.6790367630377178,2025-03-18 11:56:33.550481,2025-03-18 11:57:33.885309,0 days 00:01:00.334828,20,PCA,ETs,SMOTE,,COMPLETE
60,0.7088557627682643,2025-03-18 11:56:34.405700,2025-03-18 11:57:26.004712,0 days 00:00:51.599012,50,PCA,ETs,SVMSMOTE,,COMPLETE
61,0.6848272950421127,2025-03-18 11:56:34.620493,2025-03-18 11:57:24.037703,0 days 00:00:49.417210,20,PCA,ETs,SMOTE,,COMPLETE
62,0.6681934475584069,2025-03-18 11:56:35.075145,2025-03-18 11:58:01.026661,0 days 00:01:25.951516,20,PCA,ETs,SMOTE,,COMPLETE
63,0.7446207259701758,2025-03-18 11:56:35.213311,2025-03-18 11:57:31.524577,0 days 00:00:56.311266,50,RFE,ETs,BorderlineSMOTE,,COMPLETE
64,0.6652754352102865,2025-03-18 11:56:35.370577,2025-03-18 11:57:11.705558,0 days 00:00:36.334981,20,PCA,ETs,SMOTE,,COMPLETE
65,0.6829367692228246,2025-03-18 11:56:35.514207,2025-03-18 11:57:38.833639,0 days 00:01:03.319432,50,RFE,KNN,BorderlineSMOTE,MaxAbs,COMPLETE
66,0.7725693906173412,2025-03-18 11:56:35.670788,2025-03-18 11:57:50.019973,0 days 00:01:14.349185,50,RFE,MLP,BorderlineSMOTE,MaxAbs,COMPLETE
67,0.6482230907460446,2025-03-18 11:56:36.010638,2025-03-18 11:57:13.600522,0 days 00:00:37.589884,20,PCA,ETs,SMOTE,QT,COMPLETE
68,0.698122694101299,2025-03-18 11:56:36.430550,2025-03-18 11:57:38.097923,0 days 00:01:01.667373,20,PCA,ETs,SMOTE,,COMPLETE
69,0.7459939192976857,2025-03-18 11:56:41.220641,2025-03-18 11:57:43.049302,0 days 00:01:01.828661,50,PCA,ETs,SMOTE,,COMPLETE
70,0.6497944556099168,2025-03-18 11:56:42.115620,2025-03-18 11:57:06.773755,0 days 00:00:24.658135,20,PCA,ETs,SMOTE,,COMPLETE
71,0.7782313430689447,2025-03-18 11:56:42.505319,2025-03-18 11:57:36.300853,0 days 00:00:53.795534,50,Chi2,MLP,BorderlineSMOTE,MaxAbs,COMPLETE
72,0.0,2025-03-18 11:56:42.760800,2025-03-18 11:57:54.340923,0 days 00:01:11.580123,10,Chi2,MLP,SVMSMOTE,Robust,COMPLETE
73,0.8055352921447252,2025-03-18 11:56:43.090717,2025-03-18 11:57:43.175755,0 days 00:01:00.085038,50,RFE,MLP,BorderlineSMOTE,MaxAbs,COMPLETE
74,0.7472537064909617,2025-03-18 11:56:45.712838,2025-03-18 11:57:54.341151,0 days 00:01:08.628313,50,,MLP,BorderlineSMOTE,MaxAbs,COMPLETE
75,0.729911476064683,2025-03-18 11:56:47.750782,2025-03-18 11:57:37.987883,0 days 00:00:50.237101,50,PCA,ETs,BorderlineSMOTE,,COMPLETE
76,0.7060534173816746,2025-03-18 11:56:49.132529,2025-03-18 11:57:40.562882,0 days 00:00:51.430353,50,RFE,ETs,BorderlineSMOTE,,COMPLETE
77,0.7836527861762328,2025-03-18 11:56:49.940662,2025-03-18 11:57:51.005036,0 days 00:01:01.064374,10,,MLP,BorderlineSMOTE,MaxAbs,COMPLETE
78,0.7399128938721315,2025-03-18 11:56:50.130706,2025-03-18 11:57:51.411084,0 days 00:01:01.280378,50,RFE,KNN,BorderlineSMOTE,MaxAbs,COMPLETE
79,0.7697829333419474,2025-03-18 11:56:50.901702,2025-03-18 11:57:47.395877,0 days 00:00:56.494175,50,RFE,MLP,BorderlineSMOTE,MaxAbs,COMPLETE
80,0.6790367630377178,2025-03-18 11:56:52.600742,2025-03-18 11:57:49.300906,0 days 00:00:56.700164,50,RFE,KNN,BorderlineSMOTE,Robust,COMPLETE
81,0.7716463691758332,2025-03-18 11:56:52.800582,2025-03-18 11:57:51.875715,0 days 00:00:59.075133,50,,MLP,BorderlineSMOTE,Robust,COMPLETE
82,0.7242649313055878,2025-03-18 11:56:52.980602,2025-03-18 11:58:00.324154,0 days 00:01:07.343552,90,Chi2,MLP,ADASYN,MaxAbs,COMPLETE
83,0.7529268235237533,2025-03-18 11:56:51.550498,2025-03-18 11:57:54.960820,0 days 00:01:03.410322,50,RFE,MLP,BorderlineSMOTE,MaxAbs,COMPLETE
84,0.0,2025-03-18 11:56:53.537250,2025-03-18 11:57:42.097635,0 days 00:00:48.560385,10,RFE,MLP,SVMSMOTE,Robust,COMPLETE
85,0.0,2025-03-18 11:56:53.800493,2025-03-18 11:57:50.385852,0 days 00:00:56.585359,10,Chi2,MLP,BorderlineSMOTE,Robust,COMPLETE
86,0.0,2025-03-18 11:56:54.000473,2025-03-18 11:57:51.000496,0 days 00:00:57.000023,10,Chi2,MLP,SVMSMOTE,Robust,COMPLETE
87,0.0,2025-03-18 11:56:54.981051,2025-03-18 11:57:45.395564,0 days 00:00:50.414513,10,RFE,MLP,BorderlineSMOTE,Robust,COMPLETE
88,0.7780684857515114,2025-03-18 11:56:58.917464,2025-03-18 11:57:52.765846,0 days 00:00:53.848382,60,,MLP,SVMSMOTE,Robust,COMPLETE
89,0.7741817494249892,2025-03-18 11:56:59.220616,2025-03-18 11:58:10.026333,0 days 00:01:10.805717,10,,MLP,SVMSMOTE,Robust,COMPLETE
90,0.7920474378221631,2025-03-18 11:56:59.470724,2025-03-18 11:57:54.837619,0 days 00:00:55.366895,10,,MLP,SVMSMOTE,Robust,COMPLETE
91,0.0,2025-03-18 11:57:02.125946,2025-03-18 11:57:51.830814,0 days 00:00:49.704868,10,RFE,MLP,SVMSMOTE,Robust,COMPLETE
92,0.0,2025-03-18 11:57:03.349256,2025-03-18 11:57:54.150530,0 days 00:00:50.801274,10,Chi2,MLP,SVMSMOTE,Robust,COMPLETE
93,0.7958909878685152,2025-03-18 11:57:05.565797,2025-03-18 11:58:13.349261,0 days 00:01:07.783464,90,Chi2,MLP,BorderlineSMOTE,MaxAbs,COMPLETE
94,0.7355315004924956,2025-03-18 11:57:07.240715,2025-03-18 11:57:57.274948,0 days 00:00:50.034233,90,Chi2,MLP,BorderlineSMOTE,MaxAbs,COMPLETE
95,0.0,2025-03-18 11:57:08.475365,2025-03-18 11:57:58.819592,0 days 00:00:50.344227,100,Chi2,MLP,ADASYN,MaxAbs,COMPLETE
96,0.34369747899170267,2025-03-18 11:57:08.993807,2025-03-18 11:58:19.363058,0 days 00:01:10.369251,50,,MLP,BorderlineSMOTE,Normalizer,COMPLETE
97,0.0,2025-03-18 11:57:09.420513,2025-03-18 11:58:13.729260,0 days 00:01:04.308747,90,RF,MLP,BorderlineSMOTE,Normalizer,COMPLETE
98,0.0,2025-03-18 11:57:10.630601,2025-03-18 11:58:12.737212,0 days 00:01:02.106611,50,RF,MLP,BorderlineSMOTE,Normalizer,COMPLETE
99,0.0,2025-03-18 11:57:12.180476,2025-03-18 11:57:53.631055,0 days 00:00:41.450579,10,Chi2,MLP,SVMSMOTE,Robust,COMPLETE
100,0.0,2025-03-18 11:57:13.070727,2025-03-18 11:58:20.959868,0 days 00:01:07.889141,30,RF,MLP,BorderlineSMOTE,Normalizer,COMPLETE
101,0.7633117303914927,2025-03-18 11:57:23.327115,2025-03-18 11:58:17.664138,0 days 00:00:54.337023,90,Chi2,MLP,BorderlineSMOTE,MaxAbs,COMPLETE
102,0.0,2025-03-18 11:57:28.544314,2025-03-18 11:58:14.825386,0 days 00:00:46.281072,30,RF,MLP,BorderlineSMOTE,Normalizer,COMPLETE
103,0.0,2025-03-18 11:57:32.448102,2025-03-18 11:58:10.337287,0 days 00:00:37.889185,100,RF,MLP,BorderlineSMOTE,Normalizer,COMPLETE
104,0.0,2025-03-18 11:57:34.695925,2025-03-18 11:58:18.858969,0 days 00:00:44.163044,30,RF,MLP,BorderlineSMOTE,Normalizer,COMPLETE
105,0.7630767459411997,2025-03-18 11:57:35.704729,2025-03-18 11:58:54.969539,0 days 00:01:19.264810,10,,RF,SVMSMOTE,Robust,COMPLETE
106,0.0,2025-03-18 11:57:39.688861,2025-03-18 11:58:13.921248,0 days 00:00:34.232387,100,RF,MLP,BorderlineSMOTE,Normalizer,COMPLETE
107,0.7501317829566003,2025-03-18 11:57:44.617850,2025-03-18 11:58:32.330989,0 days 00:00:47.713139,10,,AB,SVMSMOTE,Robust,COMPLETE
108,0.0,2025-03-18 11:57:46.038828,2025-03-18 11:58:12.533216,0 days 00:00:26.494388,50,RF,MLP,BorderlineSMOTE,Normalizer,COMPLETE
109,0.7540540701656445,2025-03-18 11:57:46.549128,2025-03-18 11:58:57.171110,0 days 00:01:10.621982,10,,AB,BorderlineSMOTE,Robust,COMPLETE
110,0.0,2025-03-18 11:57:47.912414,2025-03-18 11:58:13.721244,0 days 00:00:25.808830,30,RF,MLP,BorderlineSMOTE,Normalizer,COMPLETE
111,0.7298507174364943,2025-03-18 11:57:49.280903,2025-03-18 11:59:01.650847,0 days 00:01:12.369944,40,MI,DT,SVMSMOTE,QT,COMPLETE
112,0.0,2025-03-18 11:57:50.205054,2025-03-18 11:58:29.070717,0 days 00:00:38.865663,30,RF,MLP,BorderlineSMOTE,Normalizer,COMPLETE
113,0.739025017928366,2025-03-18 11:57:50.725539,2025-03-18 11:58:23.172517,0 days 00:00:32.446978,90,ANOVA,AB,BorderlineSMOTE,Robust,COMPLETE
114,0.34369747899170267,2025-03-18 11:57:51.040917,2025-03-18 11:58:18.317687,0 days 00:00:27.276770,30,,MLP,BorderlineSMOTE,Normalizer,COMPLETE
115,0.7772185446937507,2025-03-18 11:57:53.481150,2025-03-18 11:58:22.716846,0 days 00:00:29.235696,30,,MLP,BorderlineSMOTE,Robust,COMPLETE
116,0.7459939192976857,2025-03-18 11:57:54.630911,2025-03-18 11:58:47.930910,0 days 00:00:53.299999,40,,DT,SVMSMOTE,QT,COMPLETE
117,0.7474090425701818,2025-03-18 11:57:56.446921,2025-03-18 11:58:31.620917,0 days 00:00:35.173996,10,,AB,SVMSMOTE,Robust,COMPLETE
118,0.7474090425701818,2025-03-18 11:58:00.022176,2025-03-18 11:58:45.130136,0 days 00:00:45.107960,90,,AB,BorderlineSMOTE,Robust,COMPLETE
119,0.7746408430277316,2025-03-18 11:58:00.182523,2025-03-18 11:58:32.180842,0 days 00:00:31.998319,40,,AB,SVMSMOTE,Robust,COMPLETE
120,0.7669900743406874,2025-03-18 11:58:00.324154,2025-03-18 11:58:29.081007,0 days 00:00:28.756853,90,,AB,BorderlineSMOTE,Robust,COMPLETE
121,0.0,2025-03-18 11:58:00.866678,2025-03-18 11:58:52.063514,0 days 00:00:51.196836,80,LDA,SGD,SVMSMOTE,QT,COMPLETE
122,0.7617869271701736,2025-03-18 11:58:05.662460,2025-03-18 11:58:40.550838,0 days 00:00:34.888378,40,,DT,SVMSMOTE,Robust,COMPLETE
123,0.7151265246434002,2025-03-18 11:58:06.144196,2025-03-18 11:58:57.171110,0 days 00:00:51.026914,60,,SGD,SVMSMOTE,Robust,COMPLETE
124,0.7411256675012456,2025-03-18 11:58:06.300365,2025-03-18 11:58:48.140327,0 days 00:00:41.839962,40,MI,DT,SVMSMOTE,QT,COMPLETE
125,0.7138828192458411,2025-03-18 11:58:06.789284,2025-03-18 11:58:41.590331,0 days 00:00:34.801047,40,,DT,SVMSMOTE,Robust,COMPLETE
126,0.7067172183508413,2025-03-18 11:58:06.984327,2025-03-18 11:58:44.252695,0 days 00:00:37.268368,40,,DT,SVMSMOTE,Robust,COMPLETE
127,0.7866439772407294,2025-03-18 11:58:07.137325,2025-03-18 11:59:07.700743,0 days 00:01:00.563418,70,,RF,,MinMax,COMPLETE
128,0.7043162812173325,2025-03-18 11:58:07.852287,2025-03-18 11:58:44.670854,0 days 00:00:36.818567,40,,DT,SVMSMOTE,Robust,COMPLETE
129,0.7369188571409789,2025-03-18 11:58:09.795316,2025-03-18 11:59:29.720530,0 days 00:01:19.925214,70,,MLP,BorderlineSMOTE,MaxAbs,COMPLETE
130,0.7412092683310522,2025-03-18 11:58:10.331312,2025-03-18 11:59:20.955624,0 days 00:01:10.624312,50,ANOVA,RF,ADASYN,MaxAbs,COMPLETE
131,0.7746196411248566,2025-03-18 11:58:10.507287,2025-03-18 11:58:55.373947,0 days 00:00:44.866660,40,,RF,SVMSMOTE,Robust,COMPLETE
132,0.7221923966528976,2025-03-18 11:58:12.113653,2025-03-18 11:58:37.066252,0 days 00:00:24.952599,40,,DT,SVMSMOTE,Robust,COMPLETE
133,0.7550524691412344,2025-03-18 11:58:12.312297,2025-03-18 11:59:12.282827,0 days 00:00:59.970530,80,,RF,,MaxAbs,COMPLETE
134,0.0,2025-03-18 11:58:12.733213,2025-03-18 11:59:02.700732,0 days 00:00:49.967519,80,LDA,RF,ADASYN,MinMax,COMPLETE
135,0.6932967259449898,2025-03-18 11:58:13.141218,2025-03-18 11:58:50.859806,0 days 00:00:37.718588,40,MI,DT,SVMSMOTE,QT,COMPLETE
136,0.727703022163994,2025-03-18 11:58:13.525221,2025-03-18 11:58:51.930766,0 days 00:00:38.405545,40,MI,DT,SVMSMOTE,QT,COMPLETE
137,0.742416238620901,2025-03-18 11:58:14.591004,2025-03-18 11:59:08.040815,0 days 00:00:53.449811,80,MI,SGD,ADASYN,QT,COMPLETE
138,0.7239610519496134,2025-03-18 11:58:15.005432,2025-03-18 11:59:16.470771,0 days 00:01:01.465339,50,ANOVA,RF,BorderlineSMOTE,Robust,COMPLETE
139,0.7067172183508413,2025-03-18 11:58:15.370664,2025-03-18 11:58:45.862701,0 days 00:00:30.492037,40,,DT,SVMSMOTE,QT,COMPLETE
140,0.8045454075053374,2025-03-18 11:58:16.529668,2025-03-18 11:58:53.422864,0 days 00:00:36.893196,40,MI,RF,SVMSMOTE,QT,COMPLETE
141,0.0,2025-03-18 11:58:17.187413,2025-03-18 11:59:08.910957,0 days 00:00:51.723544,40,LDA,RF,SVMSMOTE,Robust,COMPLETE
142,0.7172254899287229,2025-03-18 11:58:18.120494,2025-03-18 11:58:57.027349,0 days 00:00:38.906855,40,MI,RF,SVMSMOTE,Robust,COMPLETE
143,0.6881559390558489,2025-03-18 11:58:19.003707,2025-03-18 11:59:07.036669,0 days 00:00:48.032962,60,MI,SGD,ADASYN,QT,COMPLETE
144,0.7273552758935871,2025-03-18 11:58:20.390496,2025-03-18 11:58:54.505230,0 days 00:00:34.114734,40,MI,DT,SVMSMOTE,QT,COMPLETE
145,0.0,2025-03-18 11:58:22.269792,2025-03-18 11:59:01.660877,0 days 00:00:39.391085,80,LDA,SGD,ADASYN,MinMax,COMPLETE
146,0.7341019821015218,2025-03-18 11:58:22.912931,2025-03-18 11:59:02.236762,0 days 00:00:39.323831,40,MI,RF,SVMSMOTE,QT,COMPLETE
147,0.7391025842763737,2025-03-18 11:58:23.180500,2025-03-18 11:59:20.943009,0 days 00:00:57.762509,50,,RF,BorderlineSMOTE,MaxAbs,COMPLETE
148,0.7327247612759769,2025-03-18 11:58:24.845868,2025-03-18 11:59:16.721265,0 days 00:00:51.875397,50,ANOVA,RF,BorderlineSMOTE,MinMax,COMPLETE
149,0.0,2025-03-18 11:58:24.889894,2025-03-18 11:59:02.466517,0 days 00:00:37.576623,70,LDA,RF,,MinMax,COMPLETE
150,0.0,2025-03-18 11:58:30.100679,2025-03-18 11:59:07.511031,0 days 00:00:37.410352,70,LDA,RF,ADASYN,QT,COMPLETE
151,0.7460826974921136,2025-03-18 11:58:30.240869,2025-03-18 11:59:36.020714,0 days 00:01:05.779845,70,,MLP,BorderlineSMOTE,MaxAbs,COMPLETE
152,0.0,2025-03-18 11:58:30.390805,2025-03-18 11:59:00.272613,0 days 00:00:29.881808,80,LDA,MLP,ADASYN,MaxAbs,COMPLETE
153,0.7719201768855013,2025-03-18 11:58:31.840761,2025-03-18 11:59:18.995366,0 days 00:00:47.154605,70,,RF,BorderlineSMOTE,MaxAbs,COMPLETE
154,0.7488846525602317,2025-03-18 11:58:32.471081,2025-03-18 11:59:36.835596,0 days 00:01:04.364515,50,,MLP,BorderlineSMOTE,MaxAbs,COMPLETE
155,0.7036996287611468,2025-03-18 11:58:33.680735,2025-03-18 11:59:36.028716,0 days 00:01:02.347981,50,,MLP,BorderlineSMOTE,MaxAbs,COMPLETE
156,0.7617869271701736,2025-03-18 11:58:34.730636,2025-03-18 11:59:09.156567,0 days 00:00:34.425931,60,ANOVA,RF,ADASYN,Robust,COMPLETE
157,0.7679768122076964,2025-03-18 11:58:37.925870,2025-03-18 11:59:09.160605,0 days 00:00:31.234735,50,,RF,BorderlineSMOTE,MinMax,COMPLETE
158,0.7342072778716734,2025-03-18 11:58:41.460884,2025-03-18 11:59:24.810753,0 days 00:00:43.349869,50,,MLP,BorderlineSMOTE,MaxAbs,COMPLETE
159,0.0,2025-03-18 11:58:42.661087,2025-03-18 11:59:59.200863,0 days 00:01:16.539776,10,RFE,MLP,,Robust,COMPLETE
160,0.7342002015305871,2025-03-18 11:58:47.020603,2025-03-18 11:59:19.954757,0 days 00:00:32.934154,70,,RF,BorderlineSMOTE,MaxAbs,COMPLETE
161,0.7322867537055041,2025-03-18 11:58:48.744720,2025-03-18 11:59:19.551002,0 days 00:00:30.806282,70,,RF,BorderlineSMOTE,MaxAbs,COMPLETE
162,0.7596633041915479,2025-03-18 11:58:49.395753,2025-03-18 11:59:48.515785,0 days 00:00:59.120032,70,,MLP,BorderlineSMOTE,Standard,COMPLETE
163,0.717023429262251,2025-03-18 11:58:50.730714,2025-03-18 12:00:02.751152,0 days 00:01:12.020438,70,,MLP,BorderlineSMOTE,Robust,COMPLETE
164,0.7492425762048621,2025-03-18 11:58:52.622281,2025-03-18 11:59:34.361030,0 days 00:00:41.738749,70,,MLP,BorderlineSMOTE,MaxAbs,COMPLETE
165,0.7722313789057631,2025-03-18 11:58:53.153529,2025-03-18 11:59:37.850629,0 days 00:00:44.697100,10,,MLP,BorderlineSMOTE,MaxAbs,COMPLETE
