number,value,datetime_start,datetime_complete,duration,params_FS Ratio,params_FS Tech,params_Model,params_OV Tech,params_Scaler,state
0,0.6880767401303409,2025-03-18 11:25:39.841454,2025-03-18 11:27:07.319587,0 days 00:01:27.478133,70,ANOVA,DT,,Normalizer,COMPLETE
1,0.6464011656881199,2025-03-18 11:25:39.851625,2025-03-18 11:26:16.656666,0 days 00:00:36.805041,60,,SGD,SVMSMOTE,QT,COMPLETE
2,0.6880767401303409,2025-03-18 11:25:39.976164,2025-03-18 11:26:41.176302,0 days 00:01:01.200138,20,ANOVA,MLP,,,COMPLETE
3,0.6854459578621426,2025-03-18 11:25:40.126474,2025-03-18 11:26:25.515333,0 days 00:00:45.388859,20,ANOVA,DT,,MinMax,COMPLETE
4,0.6832967838548042,2025-03-18 11:25:40.251501,2025-03-18 11:26:25.515333,0 days 00:00:45.263832,40,PCA,SGD,SVMSMOTE,MinMax,COMPLETE
5,0.6880767401303409,2025-03-18 11:25:40.541421,2025-03-18 11:27:18.383121,0 days 00:01:37.841700,70,RFE,DT,,Normalizer,COMPLETE
6,0.6880767401303409,2025-03-18 11:25:40.689101,2025-03-18 11:26:43.121747,0 days 00:01:02.432646,20,RFE,DT,,,COMPLETE
7,0.6880767401303409,2025-03-18 11:25:40.876171,2025-03-18 11:26:53.656198,0 days 00:01:12.780027,20,PCA,MLP,,MinMax,COMPLETE
8,0.0,2025-03-18 11:25:41.101528,2025-03-18 11:26:21.261834,0 days 00:00:40.160306,100,MI,KNN,SVMSMOTE,QT,COMPLETE
9,0.670026217072772,2025-03-18 11:25:41.247286,2025-03-18 11:26:07.131462,0 days 00:00:25.884176,90,Chi2,RF,SVMSMOTE,MaxAbs,COMPLETE
10,0.6880767401303409,2025-03-18 11:25:41.381360,2025-03-18 11:26:39.281288,0 days 00:00:57.899928,20,PCA,DT,,MinMax,COMPLETE
11,0.6622194974230207,2025-03-18 11:25:41.598221,2025-03-18 11:26:08.396562,0 days 00:00:26.798341,50,,KNN,SMOTE,QT,COMPLETE
12,0.6880767401303409,2025-03-18 11:25:41.724235,2025-03-18 11:26:42.031864,0 days 00:01:00.307629,70,PCA,MLP,,,COMPLETE
13,0.6854459578621426,2025-03-18 11:25:41.852405,2025-03-18 11:27:00.062532,0 days 00:01:18.210127,20,PCA,DT,,,COMPLETE
14,0.0,2025-03-18 11:25:41.994174,2025-03-18 11:26:18.036546,0 days 00:00:36.042372,100,LDA,SGD,SMOTE,Standard,COMPLETE
15,0.6880767401303409,2025-03-18 11:25:42.098205,2025-03-18 11:26:33.844488,0 days 00:00:51.746283,20,ANOVA,DT,,,COMPLETE
16,0.6880767401303409,2025-03-18 11:25:42.281513,2025-03-18 11:26:53.641416,0 days 00:01:11.359903,70,RFE,DT,,Normalizer,COMPLETE
17,0.6880767401303409,2025-03-18 11:25:42.411627,2025-03-18 11:27:36.894265,0 days 00:01:54.482638,70,RFE,MLP,,,COMPLETE
18,0.6880767401303409,2025-03-18 11:25:42.561560,2025-03-18 11:26:09.496341,0 days 00:00:26.934781,70,ANOVA,ETs,,Robust,COMPLETE
19,0.6880767401303409,2025-03-18 11:25:42.671356,2025-03-18 11:27:29.257498,0 days 00:01:46.586142,20,PCA,MLP,,,COMPLETE
20,0.7001270197926202,2025-03-18 11:25:42.781252,2025-03-18 11:26:57.631522,0 days 00:01:14.850270,90,Chi2,RF,SVMSMOTE,QT,COMPLETE
21,0.6337044872296163,2025-03-18 11:25:42.924295,2025-03-18 11:26:23.326351,0 days 00:00:40.402056,20,LDA,MLP,BorderlineSMOTE,Standard,COMPLETE
22,0.0,2025-03-18 11:25:43.054618,2025-03-18 11:26:02.771628,0 days 00:00:19.717010,40,RF,AB,ADASYN,Robust,COMPLETE
23,0.6880767401303409,2025-03-18 11:25:43.176216,2025-03-18 11:26:02.581298,0 days 00:00:19.405082,20,PCA,SGD,,Normalizer,COMPLETE
24,0.0,2025-03-18 11:25:43.288276,2025-03-18 11:26:01.483375,0 days 00:00:18.195099,90,Chi2,SGD,SMOTE,Robust,COMPLETE
25,0.6880767401303409,2025-03-18 11:25:43.411506,2025-03-18 11:26:04.316657,0 days 00:00:20.905151,60,Chi2,SGD,SMOTE,QT,COMPLETE
26,0.6880767401303409,2025-03-18 11:25:43.551445,2025-03-18 11:26:23.651471,0 days 00:00:40.100026,30,RF,SGD,,,COMPLETE
27,0.5881770221375082,2025-03-18 11:25:43.682496,2025-03-18 11:26:18.364972,0 days 00:00:34.682476,90,MI,AB,ADASYN,MinMax,COMPLETE
28,0.5937162760239321,2025-03-18 11:25:43.801876,2025-03-18 11:26:20.121881,0 days 00:00:36.320005,40,PCA,SGD,SMOTE,QT,COMPLETE
29,0.5811844754445905,2025-03-18 11:25:43.921250,2025-03-18 11:26:07.900242,0 days 00:00:23.978992,30,,ETs,BorderlineSMOTE,Normalizer,COMPLETE
30,0.0,2025-03-18 11:25:44.084151,2025-03-18 11:26:12.004131,0 days 00:00:27.919980,30,LDA,RF,SVMSMOTE,MinMax,COMPLETE
31,0.5486610970220566,2025-03-18 11:25:44.185244,2025-03-18 11:26:22.106541,0 days 00:00:37.921297,80,ANOVA,AB,SMOTE,Standard,COMPLETE
32,0.6880767401303409,2025-03-18 11:25:44.306180,2025-03-18 11:26:26.806267,0 days 00:00:42.500087,20,ANOVA,MLP,,,COMPLETE
33,0.6147993224763433,2025-03-18 11:25:44.458397,2025-03-18 11:26:09.611712,0 days 00:00:25.153315,90,,ETs,ADASYN,Standard,COMPLETE
34,0.0,2025-03-18 11:25:44.591239,2025-03-18 11:26:06.686241,0 days 00:00:22.095002,40,LDA,RF,SVMSMOTE,Standard,COMPLETE
35,0.6880767401303409,2025-03-18 11:25:44.751605,2025-03-18 11:26:22.845300,0 days 00:00:38.093695,90,Chi2,SGD,,MaxAbs,COMPLETE
36,0.6880767401303409,2025-03-18 11:25:44.886598,2025-03-18 11:26:53.417793,0 days 00:01:08.531195,70,PCA,MLP,,,COMPLETE
37,0.6854459578621426,2025-03-18 11:25:45.121515,2025-03-18 11:26:57.159540,0 days 00:01:12.038025,70,RFE,DT,,Normalizer,COMPLETE
38,0.6880767401303409,2025-03-18 11:25:45.246735,2025-03-18 11:26:50.091637,0 days 00:01:04.844902,70,ANOVA,DT,,Normalizer,COMPLETE
39,0.0,2025-03-18 11:25:45.431267,2025-03-18 11:26:19.561383,0 days 00:00:34.130116,10,MI,ETs,SVMSMOTE,Robust,COMPLETE
40,0.0,2025-03-18 11:25:45.572939,2025-03-18 11:26:06.971638,0 days 00:00:21.398699,100,LDA,AB,SVMSMOTE,Normalizer,COMPLETE
41,0.6880767401303409,2025-03-18 11:25:45.711466,2025-03-18 11:26:36.906444,0 days 00:00:51.194978,20,PCA,DT,,,COMPLETE
42,0.5107102890784743,2025-03-18 11:25:45.711466,2025-03-18 11:26:22.471265,0 days 00:00:36.759799,60,,RF,SMOTE,Robust,COMPLETE
43,0.6339363806697561,2025-03-18 11:25:45.881608,2025-03-18 11:26:13.981708,0 days 00:00:28.100100,40,Chi2,KNN,BorderlineSMOTE,QT,COMPLETE
44,0.6854459578621426,2025-03-18 11:25:46.221249,2025-03-18 11:27:24.182384,0 days 00:01:37.961135,20,RFE,DT,,,COMPLETE
45,0.34369747899170267,2025-03-18 11:25:46.506225,2025-03-18 11:26:31.871443,0 days 00:00:45.365218,60,,SGD,BorderlineSMOTE,Normalizer,COMPLETE
46,0.6880767401303409,2025-03-18 11:25:46.671503,2025-03-18 11:26:41.761865,0 days 00:00:55.090362,70,ANOVA,DT,,,COMPLETE
47,0.6880767401303409,2025-03-18 11:25:46.861249,2025-03-18 11:26:55.746336,0 days 00:01:08.885087,70,PCA,MLP,,,COMPLETE
48,0.6880767401303409,2025-03-18 11:25:47.102385,2025-03-18 11:26:57.771615,0 days 00:01:10.669230,20,ANOVA,DT,,,COMPLETE
49,0.5816027872411558,2025-03-18 11:25:47.311499,2025-03-18 11:26:23.764981,0 days 00:00:36.453482,30,,MLP,BorderlineSMOTE,Robust,COMPLETE
50,0.6880767401303409,2025-03-18 11:25:47.480415,2025-03-18 11:27:01.751578,0 days 00:01:14.271163,70,RFE,DT,,Normalizer,COMPLETE
51,0.6880767401303409,2025-03-18 11:25:47.637521,2025-03-18 11:27:11.788722,0 days 00:01:24.151201,70,RFE,DT,,Normalizer,COMPLETE
52,0.6880767401303409,2025-03-18 11:25:52.692501,2025-03-18 11:27:24.245387,0 days 00:01:31.552886,70,RFE,DT,,Normalizer,COMPLETE
53,0.6880767401303409,2025-03-18 11:25:56.531606,2025-03-18 11:27:27.490790,0 days 00:01:30.959184,70,ANOVA,DT,,,COMPLETE
54,0.6854459578621426,2025-03-18 11:26:06.021406,2025-03-18 11:27:25.702735,0 days 00:01:19.681329,70,RFE,DT,,Normalizer,COMPLETE
55,0.6880767401303409,2025-03-18 11:26:07.401289,2025-03-18 11:27:24.170370,0 days 00:01:16.769081,70,RFE,DT,,Normalizer,COMPLETE
56,0.6880767401303409,2025-03-18 11:26:30.701441,2025-03-18 11:27:43.191438,0 days 00:01:12.489997,70,RFE,MLP,,,COMPLETE
57,0.6880767401303409,2025-03-18 11:26:34.511356,2025-03-18 11:27:26.724763,0 days 00:00:52.213407,70,RFE,MLP,,,COMPLETE
58,0.6880767401303409,2025-03-18 11:26:35.313657,2025-03-18 11:27:27.025245,0 days 00:00:51.711588,70,RFE,DT,,,COMPLETE
59,0.6369869395994938,2025-03-18 11:26:36.151235,2025-03-18 11:27:43.821804,0 days 00:01:07.670569,50,RFE,MLP,SVMSMOTE,MinMax,COMPLETE
60,0.6880767401303409,2025-03-18 11:26:36.781584,2025-03-18 11:27:47.361708,0 days 00:01:10.580124,20,RFE,MLP,SVMSMOTE,MinMax,COMPLETE
61,0.6880767401303409,2025-03-18 11:26:37.246326,2025-03-18 11:27:28.801827,0 days 00:00:51.555501,70,RFE,MLP,,,COMPLETE
62,0.6859381668303224,2025-03-18 11:26:37.535209,2025-03-18 11:27:56.875110,0 days 00:01:19.339901,50,RFE,RF,SVMSMOTE,MinMax,COMPLETE
63,0.696372989542114,2025-03-18 11:26:38.671490,2025-03-18 11:27:45.876306,0 days 00:01:07.204816,50,RFE,RF,SVMSMOTE,MinMax,COMPLETE
64,0.0,2025-03-18 11:26:39.116482,2025-03-18 11:27:50.881567,0 days 00:01:11.765085,80,RF,RF,SVMSMOTE,MinMax,COMPLETE
65,0.6880767401303409,2025-03-18 11:26:39.496392,2025-03-18 11:27:30.974193,0 days 00:00:51.477801,20,RFE,MLP,,,COMPLETE
66,0.6880767401303409,2025-03-18 11:26:39.676587,2025-03-18 11:27:43.191438,0 days 00:01:03.514851,20,RFE,MLP,,MinMax,COMPLETE
67,0.6651227413052526,2025-03-18 11:26:40.206285,2025-03-18 11:27:48.671437,0 days 00:01:08.465152,50,RFE,MLP,SVMSMOTE,MinMax,COMPLETE
68,0.0,2025-03-18 11:26:40.754905,2025-03-18 11:28:13.993762,0 days 00:01:33.238857,80,RF,RF,ADASYN,QT,COMPLETE
69,0.6673590891940597,2025-03-18 11:26:40.993566,2025-03-18 11:27:49.986317,0 days 00:01:08.992751,50,RFE,MLP,SVMSMOTE,MinMax,COMPLETE
70,0.6880767401303409,2025-03-18 11:26:41.201484,2025-03-18 11:27:37.291353,0 days 00:00:56.089869,20,RFE,MLP,SVMSMOTE,MinMax,COMPLETE
71,0.6880767401303409,2025-03-18 11:26:41.391746,2025-03-18 11:27:37.281460,0 days 00:00:55.889714,50,RFE,MLP,,MinMax,COMPLETE
72,0.5151000094150892,2025-03-18 11:26:41.731720,2025-03-18 11:27:51.551518,0 days 00:01:09.819798,80,PCA,RF,ADASYN,MinMax,COMPLETE
73,0.6624394375820676,2025-03-18 11:26:42.561464,2025-03-18 11:27:43.416679,0 days 00:01:00.855215,20,RFE,MLP,SVMSMOTE,MinMax,COMPLETE
74,0.7090801293008646,2025-03-18 11:26:42.720889,2025-03-18 11:27:59.311592,0 days 00:01:16.590703,50,RFE,RF,SVMSMOTE,QT,COMPLETE
75,0.0,2025-03-18 11:26:43.466586,2025-03-18 11:28:04.831735,0 days 00:01:21.365149,50,RF,RF,SVMSMOTE,MinMax,COMPLETE
76,0.0,2025-03-18 11:26:45.781431,2025-03-18 11:27:47.626639,0 days 00:01:01.845208,50,RF,RF,SVMSMOTE,QT,COMPLETE
77,0.0,2025-03-18 11:26:49.751442,2025-03-18 11:27:44.181768,0 days 00:00:54.430326,50,RF,RF,SVMSMOTE,MinMax,COMPLETE
78,0.6704075978607407,2025-03-18 11:26:50.901446,2025-03-18 11:27:48.295042,0 days 00:00:57.393596,50,RFE,MLP,SVMSMOTE,MinMax,COMPLETE
79,0.6558529294498245,2025-03-18 11:26:52.363773,2025-03-18 11:27:48.781451,0 days 00:00:56.417678,50,RFE,MLP,SVMSMOTE,MinMax,COMPLETE
80,0.0,2025-03-18 11:26:53.201677,2025-03-18 11:27:45.631486,0 days 00:00:52.429809,10,RF,RF,SVMSMOTE,MinMax,COMPLETE
81,0.6753473348561533,2025-03-18 11:26:55.001838,2025-03-18 11:27:48.513327,0 days 00:00:53.511489,50,RFE,RF,SVMSMOTE,MaxAbs,COMPLETE
82,0.6880767401303409,2025-03-18 11:26:56.032486,2025-03-18 11:28:09.436353,0 days 00:01:13.403867,90,PCA,KNN,,QT,COMPLETE
83,0.6854459578621426,2025-03-18 11:26:56.706382,2025-03-18 11:28:13.833108,0 days 00:01:17.126726,90,PCA,KNN,,QT,COMPLETE
84,0.0,2025-03-18 11:26:57.461605,2025-03-18 11:27:47.351740,0 days 00:00:49.890135,80,RF,RF,ADASYN,MinMax,COMPLETE
85,0.6880767401303409,2025-03-18 11:27:00.939189,2025-03-18 11:28:15.520454,0 days 00:01:14.581265,90,PCA,KNN,,QT,COMPLETE
86,0.0,2025-03-18 11:27:02.781214,2025-03-18 11:27:46.927823,0 days 00:00:44.146609,50,RF,RF,SVMSMOTE,MinMax,COMPLETE
87,0.0,2025-03-18 11:27:05.403496,2025-03-18 11:27:51.563181,0 days 00:00:46.159685,80,RF,RF,ADASYN,MinMax,COMPLETE
88,0.6585223763354029,2025-03-18 11:27:06.451674,2025-03-18 11:28:01.023140,0 days 00:00:54.571466,90,PCA,KNN,SMOTE,QT,COMPLETE
89,0.0,2025-03-18 11:27:10.913625,2025-03-18 11:27:47.993230,0 days 00:00:37.079605,80,RF,RF,ADASYN,MinMax,COMPLETE
90,0.6828110974336358,2025-03-18 11:27:16.142209,2025-03-18 11:28:05.361993,0 days 00:00:49.219784,90,Chi2,KNN,SMOTE,MaxAbs,COMPLETE
91,0.6880767401303409,2025-03-18 11:27:17.596694,2025-03-18 11:28:49.085445,0 days 00:01:31.488751,20,MI,DT,BorderlineSMOTE,,COMPLETE
92,0.6620114839295395,2025-03-18 11:27:22.471611,2025-03-18 11:28:02.706313,0 days 00:00:40.234702,80,Chi2,KNN,ADASYN,QT,COMPLETE
93,0.6798706703691473,2025-03-18 11:27:30.406787,2025-03-18 11:28:14.378414,0 days 00:00:43.971627,90,PCA,KNN,,QT,COMPLETE
94,0.6828110974336358,2025-03-18 11:27:32.022689,2025-03-18 11:27:58.311474,0 days 00:00:26.288785,90,Chi2,KNN,SMOTE,QT,COMPLETE
95,0.6880767401303409,2025-03-18 11:27:36.881495,2025-03-18 11:28:04.011656,0 days 00:00:27.130161,90,PCA,KNN,,QT,COMPLETE
96,0.0,2025-03-18 11:27:39.131367,2025-03-18 11:28:08.210696,0 days 00:00:29.079329,100,PCA,AB,,QT,COMPLETE
97,0.6880767401303409,2025-03-18 11:27:39.671804,2025-03-18 11:28:33.530387,0 days 00:00:53.858583,20,ANOVA,DT,,Standard,COMPLETE
98,0.6880767401303409,2025-03-18 11:27:42.366468,2025-03-18 11:28:13.998733,0 days 00:00:31.632265,90,PCA,AB,,QT,COMPLETE
99,0.58152090194836,2025-03-18 11:27:42.741560,2025-03-18 11:28:37.189455,0 days 00:00:54.447895,20,MI,ETs,BorderlineSMOTE,Normalizer,COMPLETE
100,0.6880767401303409,2025-03-18 11:27:45.881462,2025-03-18 11:28:33.865428,0 days 00:00:47.983966,20,ANOVA,DT,,Standard,COMPLETE
101,0.0,2025-03-18 11:27:46.916531,2025-03-18 11:28:09.034170,0 days 00:00:22.117639,100,PCA,AB,,QT,COMPLETE
102,0.0,2025-03-18 11:27:47.193343,2025-03-18 11:28:22.297668,0 days 00:00:35.104325,100,PCA,AB,,QT,COMPLETE
103,0.6880767401303409,2025-03-18 11:27:47.691623,2025-03-18 11:28:37.588127,0 days 00:00:49.896504,20,ANOVA,DT,,Standard,COMPLETE
104,0.0,2025-03-18 11:27:48.513327,2025-03-18 11:28:12.194913,0 days 00:00:23.681586,100,ANOVA,AB,,QT,COMPLETE
105,0.0,2025-03-18 11:27:50.721714,2025-03-18 11:28:53.551770,0 days 00:01:02.830056,60,LDA,DT,,,COMPLETE
106,0.6880767401303409,2025-03-18 11:27:51.201702,2025-03-18 11:28:14.724031,0 days 00:00:23.522329,20,ANOVA,DT,,MaxAbs,COMPLETE
107,0.674881665885896,2025-03-18 11:27:52.161569,2025-03-18 11:28:59.735155,0 days 00:01:07.573586,60,Chi2,DT,,,COMPLETE
108,0.34369747899170267,2025-03-18 11:27:53.821497,2025-03-18 11:28:31.663640,0 days 00:00:37.842143,20,MI,DT,BorderlineSMOTE,Normalizer,COMPLETE
109,0.6880767401303409,2025-03-18 11:27:54.396405,2025-03-18 11:28:26.303526,0 days 00:00:31.907121,20,ANOVA,DT,,Standard,COMPLETE
110,0.6880767401303409,2025-03-18 11:27:54.726533,2025-03-18 11:29:42.721376,0 days 00:01:47.994843,30,RFE,MLP,SVMSMOTE,Robust,COMPLETE
111,0.5557224851167297,2025-03-18 11:27:55.286426,2025-03-18 11:28:36.364918,0 days 00:00:41.078492,20,ANOVA,ETs,BorderlineSMOTE,Standard,COMPLETE
112,0.6880767401303409,2025-03-18 11:27:55.576821,2025-03-18 11:28:41.957038,0 days 00:00:46.380217,20,ANOVA,DT,,Normalizer,COMPLETE
113,0.34369747899170267,2025-03-18 11:27:56.586708,2025-03-18 11:28:48.329738,0 days 00:00:51.743030,20,MI,DT,BorderlineSMOTE,,COMPLETE
114,0.6880767401303409,2025-03-18 11:27:57.133307,2025-03-18 11:29:11.815151,0 days 00:01:14.681844,70,Chi2,SGD,,Normalizer,COMPLETE
115,0.5750888800913921,2025-03-18 11:27:57.511418,2025-03-18 11:29:15.576111,0 days 00:01:18.064693,20,MI,DT,BorderlineSMOTE,,COMPLETE
116,0.6880767401303409,2025-03-18 11:27:58.861648,2025-03-18 11:29:28.669599,0 days 00:01:29.807951,70,RFE,MLP,SVMSMOTE,Robust,COMPLETE
117,0.6880767401303409,2025-03-18 11:27:59.126646,2025-03-18 11:29:20.974635,0 days 00:01:21.847989,70,RFE,SGD,,Normalizer,COMPLETE
118,0.6614774679071612,2025-03-18 11:28:00.841648,2025-03-18 11:28:34.054481,0 days 00:00:33.212833,20,MI,ETs,BorderlineSMOTE,Standard,COMPLETE
119,0.6880767401303409,2025-03-18 11:28:02.389160,2025-03-18 11:28:54.410070,0 days 00:00:52.020910,40,Chi2,DT,,,COMPLETE
120,0.5587719697777056,2025-03-18 11:28:03.357447,2025-03-18 11:28:42.189338,0 days 00:00:38.831891,20,ANOVA,DT,BorderlineSMOTE,,COMPLETE
121,0.6801721209715698,2025-03-18 11:28:04.011656,2025-03-18 11:28:49.473564,0 days 00:00:45.461908,60,ANOVA,DT,,,COMPLETE
122,0.6880767401303409,2025-03-18 11:28:04.511279,2025-03-18 11:29:33.608497,0 days 00:01:29.097218,70,RFE,SGD,,Normalizer,COMPLETE
123,0.6854459578621426,2025-03-18 11:28:04.681501,2025-03-18 11:29:03.919859,0 days 00:00:59.238358,40,Chi2,DT,,,COMPLETE
124,0.34369747899170267,2025-03-18 11:28:05.111596,2025-03-18 11:28:52.649901,0 days 00:00:47.538305,20,MI,DT,BorderlineSMOTE,,COMPLETE
125,0.0,2025-03-18 11:28:05.926044,2025-03-18 11:29:14.465302,0 days 00:01:08.539258,70,Chi2,SGD,,Robust,COMPLETE
126,0.6880767401303409,2025-03-18 11:28:06.181423,2025-03-18 11:29:12.999202,0 days 00:01:06.817779,70,Chi2,SGD,,Normalizer,COMPLETE
127,0.6880767401303409,2025-03-18 11:28:06.484010,2025-03-18 11:29:37.372152,0 days 00:01:30.888142,30,RFE,MLP,SVMSMOTE,Normalizer,COMPLETE
128,0.6880767401303409,2025-03-18 11:28:08.431057,2025-03-18 11:29:19.186047,0 days 00:01:10.754990,40,Chi2,DT,,,COMPLETE
129,0.6854459578621426,2025-03-18 11:28:10.770795,2025-03-18 11:28:47.708604,0 days 00:00:36.937809,20,ANOVA,ETs,,,COMPLETE
130,0.6880767401303409,2025-03-18 11:28:11.864319,2025-03-18 11:29:36.248924,0 days 00:01:24.384605,70,RFE,MLP,,Normalizer,COMPLETE
131,0.0,2025-03-18 11:28:13.070196,2025-03-18 11:28:47.164763,0 days 00:00:34.094567,60,LDA,DT,,,COMPLETE
132,0.0,2025-03-18 11:28:13.154092,2025-03-18 11:29:33.174813,0 days 00:01:20.020721,60,LDA,DT,,,COMPLETE
133,0.6880767401303409,2025-03-18 11:28:14.858702,2025-03-18 11:29:22.475959,0 days 00:01:07.617257,70,,SGD,,Normalizer,COMPLETE
134,0.0,2025-03-18 11:28:21.910770,2025-03-18 11:28:54.407110,0 days 00:00:32.496340,60,LDA,DT,,,COMPLETE
135,0.6880767401303409,2025-03-18 11:28:24.361445,2025-03-18 11:29:29.014803,0 days 00:01:04.653358,70,RFE,MLP,SVMSMOTE,Robust,COMPLETE
136,0.6880767401303409,2025-03-18 11:28:26.128252,2025-03-18 11:29:15.304308,0 days 00:00:49.176056,70,Chi2,RF,,Normalizer,COMPLETE
137,0.0,2025-03-18 11:28:26.923873,2025-03-18 11:29:42.721376,0 days 00:01:15.797503,10,RFE,MLP,SVMSMOTE,Robust,COMPLETE
138,0.34369747899170267,2025-03-18 11:28:27.179185,2025-03-18 11:29:05.929799,0 days 00:00:38.750614,70,Chi2,SGD,,Normalizer,COMPLETE
139,0.6880767401303409,2025-03-18 11:28:28.316768,2025-03-18 11:29:30.863662,0 days 00:01:02.546894,70,RFE,MLP,,Normalizer,COMPLETE
140,0.6880767401303409,2025-03-18 11:28:29.702040,2025-03-18 11:29:31.814335,0 days 00:01:02.112295,70,RFE,SGD,,Normalizer,COMPLETE
141,0.6880767401303409,2025-03-18 11:28:32.754012,2025-03-18 11:29:37.361637,0 days 00:01:04.607625,70,Chi2,SGD,,Normalizer,COMPLETE
142,0.6880767401303409,2025-03-18 11:28:33.283983,2025-03-18 11:29:37.762530,0 days 00:01:04.478547,30,RFE,MLP,SVMSMOTE,Normalizer,COMPLETE
143,0.6880767401303409,2025-03-18 11:28:36.223646,2025-03-18 11:29:50.356853,0 days 00:01:14.133207,30,RFE,MLP,SVMSMOTE,Robust,COMPLETE
144,0.6367075946672476,2025-03-18 11:28:36.870986,2025-03-18 11:29:19.075501,0 days 00:00:42.204515,70,RFE,SGD,SVMSMOTE,Normalizer,COMPLETE
145,0.6864285360390926,2025-03-18 11:28:37.189455,2025-03-18 11:29:18.669993,0 days 00:00:41.480538,70,,RF,SVMSMOTE,Normalizer,COMPLETE
146,0.6638216123054308,2025-03-18 11:28:40.628683,2025-03-18 11:29:41.311723,0 days 00:01:00.683040,70,RFE,MLP,SVMSMOTE,Robust,COMPLETE
147,0.6880767401303409,2025-03-18 11:28:40.916289,2025-03-18 11:29:21.610053,0 days 00:00:40.693764,70,RFE,MLP,,Normalizer,COMPLETE
148,0.5653926141382424,2025-03-18 11:28:42.940513,2025-03-18 11:30:09.061653,0 days 00:01:26.121140,50,PCA,ETs,SMOTE,,COMPLETE
149,0.6880767401303409,2025-03-18 11:28:43.639004,2025-03-18 11:29:49.772174,0 days 00:01:06.133170,30,RFE,MLP,SVMSMOTE,Robust,COMPLETE
150,0.6880767401303409,2025-03-18 11:28:50.047448,2025-03-18 11:29:46.801465,0 days 00:00:56.754017,30,RFE,MLP,SVMSMOTE,Robust,COMPLETE
151,0.0,2025-03-18 11:28:51.631187,2025-03-18 11:29:36.761646,0 days 00:00:45.130459,10,RFE,MLP,SVMSMOTE,Normalizer,COMPLETE
152,0.0,2025-03-18 11:28:52.228389,2025-03-18 11:29:31.178698,0 days 00:00:38.950309,10,RFE,MLP,SVMSMOTE,Normalizer,COMPLETE
153,0.6880767401303409,2025-03-18 11:28:52.451574,2025-03-18 11:30:17.511434,0 days 00:01:25.059860,20,PCA,RF,,MaxAbs,COMPLETE
154,0.6885753984984507,2025-03-18 11:28:52.797142,2025-03-18 11:30:00.586596,0 days 00:01:07.789454,70,RFE,MLP,SVMSMOTE,MaxAbs,COMPLETE
155,0.6880767401303409,2025-03-18 11:28:53.368754,2025-03-18 11:29:52.161562,0 days 00:00:58.792808,30,PCA,MLP,,Robust,COMPLETE
156,0.6893381615819315,2025-03-18 11:28:54.001068,2025-03-18 11:30:05.586641,0 days 00:01:11.585573,30,RFE,MLP,SVMSMOTE,Robust,COMPLETE
157,0.538515621430213,2025-03-18 11:29:02.457857,2025-03-18 11:30:11.281925,0 days 00:01:08.824068,50,PCA,ETs,SMOTE,,COMPLETE
158,0.6854459578621426,2025-03-18 11:29:03.498517,2025-03-18 11:30:03.203401,0 days 00:00:59.704884,50,PCA,ETs,,,COMPLETE
159,0.0,2025-03-18 11:29:08.137771,2025-03-18 11:29:53.492455,0 days 00:00:45.354684,10,RFE,ETs,,Robust,COMPLETE
160,0.6651227413052526,2025-03-18 11:29:09.449315,2025-03-18 11:29:58.266784,0 days 00:00:48.817469,50,PCA,ETs,,Robust,COMPLETE
161,0.6864285360390926,2025-03-18 11:29:11.180107,2025-03-18 11:30:55.694632,0 days 00:01:44.514525,70,ANOVA,DT,SVMSMOTE,QT,COMPLETE
162,0.0,2025-03-18 11:29:13.259385,2025-03-18 11:29:48.927761,0 days 00:00:35.668376,10,ANOVA,ETs,,Robust,COMPLETE
163,0.6880767401303409,2025-03-18 11:29:14.039979,2025-03-18 11:30:15.550186,0 days 00:01:01.510207,20,PCA,ETs,,MaxAbs,COMPLETE
164,0.5687646663731357,2025-03-18 11:29:14.950588,2025-03-18 11:29:51.091840,0 days 00:00:36.141252,50,ANOVA,RF,SMOTE,Robust,COMPLETE
165,0.0,2025-03-18 11:29:16.219531,2025-03-18 11:29:50.686567,0 days 00:00:34.467036,10,PCA,MLP,,,COMPLETE
166,0.533559325282041,2025-03-18 11:29:20.366134,2025-03-18 11:29:54.766672,0 days 00:00:34.400538,50,PCA,ETs,SMOTE,Robust,COMPLETE
167,0.6880767401303409,2025-03-18 11:29:21.109707,2025-03-18 11:30:10.571749,0 days 00:00:49.462042,20,PCA,RF,,,COMPLETE
168,0.5340443436303343,2025-03-18 11:29:22.681142,2025-03-18 11:30:05.956594,0 days 00:00:43.275452,50,PCA,ETs,SMOTE,Robust,COMPLETE
169,0.6880767401303409,2025-03-18 11:29:23.131320,2025-03-18 11:30:10.426768,0 days 00:00:47.295448,20,PCA,ETs,,MaxAbs,COMPLETE
