number,value,datetime_start,datetime_complete,duration,params_FS Ratio,params_FS Tech,params_Model,params_OV Tech,params_Scaler,state
489,0.7988315127334378,2025-03-18 12:36:51.539787,2025-03-18 12:37:31.089894,0 days 00:00:39.550107,40,,SGD,BorderlineSMOTE,QT,COMPLETE
490,0.7941575492778192,2025-03-18 12:36:51.911788,2025-03-18 12:37:39.648549,0 days 00:00:47.736761,40,,AB,BorderlineSMOTE,QT,COMPLETE
491,0.8474617327114947,2025-03-18 12:36:57.119794,2025-03-18 12:37:37.417156,0 days 00:00:40.297362,40,,RF,BorderlineSMOTE,QT,COMPLETE
492,0.791234515484405,2025-03-18 12:36:57.571746,2025-03-18 12:37:39.663581,0 days 00:00:42.091835,20,,ETs,BorderlineSMOTE,QT,COMPLETE
493,0.8042997883928539,2025-03-18 12:36:58.083778,2025-03-18 12:37:37.737157,0 days 00:00:39.653379,40,,RF,BorderlineSMOTE,QT,COMPLETE
494,0.7826798148362194,2025-03-18 12:36:59.998250,2025-03-18 12:37:43.861150,0 days 00:00:43.862900,70,,AB,BorderlineSMOTE,MaxAbs,COMPLETE
495,0.7106605681419766,2025-03-18 12:37:00.782260,2025-03-18 12:37:30.429932,0 days 00:00:29.647672,40,,SGD,BorderlineSMOTE,QT,COMPLETE
496,0.7902748414374892,2025-03-18 12:37:01.675830,2025-03-18 12:37:35.702113,0 days 00:00:34.026283,40,,RF,BorderlineSMOTE,QT,COMPLETE
497,0.817572738008048,2025-03-18 12:37:05.936237,2025-03-18 12:37:42.745799,0 days 00:00:36.809562,70,,RF,BorderlineSMOTE,Standard,COMPLETE
498,0.821121331424993,2025-03-18 12:37:08.176615,2025-03-18 12:37:40.870393,0 days 00:00:32.693778,70,,RF,BorderlineSMOTE,QT,COMPLETE
499,0.8042997883928539,2025-03-18 12:37:08.717200,2025-03-18 12:37:38.721927,0 days 00:00:30.004727,40,,RF,BorderlineSMOTE,QT,COMPLETE
