number,value,datetime_start,datetime_complete,duration,params_FS Ratio,params_FS Tech,params_Model,params_OV Tech,params_Scaler,state
0,0.7157438719299318,2025-03-18 12:10:50.306904,2025-03-18 12:11:30.374224,0 days 00:00:40.067320,90,,AB,ADASYN,Normalizer,COMPLETE
1,0.0,2025-03-18 12:10:50.317965,2025-03-18 12:11:09.090137,0 days 00:00:18.772172,30,LDA,KNN,SVMSMOTE,,COMPLETE
2,0.0,2025-03-18 12:10:50.558442,2025-03-18 12:11:19.520491,0 days 00:00:28.962049,100,MI,DT,BorderlineSMOTE,MinMax,COMPLETE
3,0.0,2025-03-18 12:10:50.715266,2025-03-18 12:11:48.750778,0 days 00:00:58.035512,10,RF,AB,SVMSMOTE,Normalizer,COMPLETE
4,0.7854888568562999,2025-03-18 12:10:50.841418,2025-03-18 12:11:09.090137,0 days 00:00:18.248719,20,LDA,MLP,BorderlineSMOTE,Robust,COMPLETE
5,0.7620207283643088,2025-03-18 12:10:50.951337,2025-03-18 12:11:10.284283,0 days 00:00:19.332946,80,,KNN,SVMSMOTE,Standard,COMPLETE
6,0.34369747899170267,2025-03-18 12:10:51.029956,2025-03-18 12:11:28.380425,0 days 00:00:37.350469,50,RFE,SGD,SMOTE,,COMPLETE
7,0.0,2025-03-18 12:10:51.155445,2025-03-18 12:11:18.326052,0 days 00:00:27.170607,70,LDA,SGD,ADASYN,MinMax,COMPLETE
8,0.0,2025-03-18 12:10:51.359627,2025-03-18 12:11:02.732133,0 days 00:00:11.372506,30,Chi2,SGD,SVMSMOTE,Normalizer,COMPLETE
9,0.7667563488302057,2025-03-18 12:10:51.469598,2025-03-18 12:11:24.877045,0 days 00:00:33.407447,60,PCA,KNN,SVMSMOTE,MinMax,COMPLETE
10,0.7872730763882967,2025-03-18 12:10:51.595178,2025-03-18 12:11:15.325459,0 days 00:00:23.730281,50,RFE,ETs,BorderlineSMOTE,Normalizer,COMPLETE
11,0.0,2025-03-18 12:10:51.705138,2025-03-18 12:11:22.222920,0 days 00:00:30.517782,30,Chi2,DT,,Robust,COMPLETE
12,0.0,2025-03-18 12:10:51.820575,2025-03-18 12:11:49.064678,0 days 00:00:57.244103,80,Chi2,ETs,BorderlineSMOTE,Normalizer,COMPLETE
13,0.7921981531886384,2025-03-18 12:10:51.925265,2025-03-18 12:11:54.247998,0 days 00:01:02.322733,50,RFE,ETs,,MaxAbs,COMPLETE
14,0.7838518052854528,2025-03-18 12:10:52.021111,2025-03-18 12:11:54.420782,0 days 00:01:02.399671,50,RFE,ETs,SMOTE,MaxAbs,COMPLETE
15,0.7857647386266061,2025-03-18 12:10:52.113300,2025-03-18 12:12:50.289334,0 days 00:01:58.176034,40,RFE,RF,,MaxAbs,COMPLETE
16,0.758525385037255,2025-03-18 12:10:52.223724,2025-03-18 12:13:07.956104,0 days 00:02:15.732380,20,RFE,MLP,BorderlineSMOTE,MaxAbs,COMPLETE
17,0.7255937751547247,2025-03-18 12:10:52.364958,2025-03-18 12:12:52.771432,0 days 00:02:00.406474,20,RFE,MLP,BorderlineSMOTE,MaxAbs,COMPLETE
18,0.0,2025-03-18 12:10:52.474872,2025-03-18 12:11:17.336946,0 days 00:00:24.862074,10,PCA,RF,SMOTE,Normalizer,COMPLETE
19,0.757704136144888,2025-03-18 12:10:52.569094,2025-03-18 12:12:59.752813,0 days 00:02:07.183719,20,RFE,MLP,BorderlineSMOTE,MaxAbs,COMPLETE
20,0.7304498070762178,2025-03-18 12:10:52.726179,2025-03-18 12:12:18.874489,0 days 00:01:26.148310,50,RFE,ETs,SMOTE,MaxAbs,COMPLETE
21,0.7670059151010244,2025-03-18 12:10:52.836123,2025-03-18 12:13:19.046655,0 days 00:02:26.210532,20,RFE,MLP,BorderlineSMOTE,MaxAbs,COMPLETE
22,0.707142070958621,2025-03-18 12:10:52.946161,2025-03-18 12:12:46.518226,0 days 00:01:53.572065,50,RFE,ETs,ADASYN,MinMax,COMPLETE
23,0.7743890593229766,2025-03-18 12:10:53.071179,2025-03-18 12:11:59.858483,0 days 00:01:06.787304,50,RFE,ETs,SMOTE,MaxAbs,COMPLETE
24,0.8019560786293294,2025-03-18 12:10:53.181091,2025-03-18 12:12:45.402696,0 days 00:01:52.221605,50,RFE,ETs,SMOTE,MaxAbs,COMPLETE
25,0.7449073905134336,2025-03-18 12:10:53.291016,2025-03-18 12:13:01.921776,0 days 00:02:08.630760,40,ANOVA,RF,,Standard,COMPLETE
26,0.0,2025-03-18 12:10:53.400814,2025-03-18 12:11:29.353811,0 days 00:00:35.952997,90,RF,SGD,ADASYN,Normalizer,COMPLETE
27,0.7557367756390752,2025-03-18 12:10:53.510640,2025-03-18 12:11:42.385853,0 days 00:00:48.875213,70,ANOVA,KNN,SVMSMOTE,Normalizer,COMPLETE
28,0.0,2025-03-18 12:10:53.620588,2025-03-18 12:11:10.284283,0 days 00:00:16.663695,10,RF,DT,ADASYN,Normalizer,COMPLETE
29,0.7893295790640148,2025-03-18 12:10:53.731046,2025-03-18 12:13:02.187813,0 days 00:02:08.456767,20,RFE,MLP,BorderlineSMOTE,MaxAbs,COMPLETE
30,0.7617869271701736,2025-03-18 12:10:53.935273,2025-03-18 12:12:18.874489,0 days 00:01:24.939216,50,RFE,ETs,BorderlineSMOTE,Robust,COMPLETE
31,0.0,2025-03-18 12:10:54.123333,2025-03-18 12:11:26.745877,0 days 00:00:32.622544,70,LDA,ETs,,,COMPLETE
32,0.7722313789057631,2025-03-18 12:10:54.217635,2025-03-18 12:11:26.950121,0 days 00:00:32.732486,50,Chi2,RF,ADASYN,QT,COMPLETE
33,0.76493474356187,2025-03-18 12:10:54.343212,2025-03-18 12:11:38.206108,0 days 00:00:43.862896,70,MI,KNN,,QT,COMPLETE
34,0.0,2025-03-18 12:10:54.468807,2025-03-18 12:11:50.604624,0 days 00:00:56.135817,100,MI,MLP,SMOTE,Standard,COMPLETE
35,0.7603032430064713,2025-03-18 12:10:54.611959,2025-03-18 12:11:28.647763,0 days 00:00:34.035804,70,MI,KNN,,Standard,COMPLETE
36,0.7937475549579647,2025-03-18 12:10:54.721781,2025-03-18 12:12:46.000027,0 days 00:01:51.278246,50,RFE,ETs,SMOTE,MaxAbs,COMPLETE
37,0.7780684857515114,2025-03-18 12:10:54.847811,2025-03-18 12:11:37.200875,0 days 00:00:42.353064,70,ANOVA,AB,SVMSMOTE,,COMPLETE
38,0.0,2025-03-18 12:10:54.957792,2025-03-18 12:11:20.289407,0 days 00:00:25.331615,30,RF,AB,ADASYN,MinMax,COMPLETE
39,0.7753495265297987,2025-03-18 12:10:55.067756,2025-03-18 12:11:19.724770,0 days 00:00:24.657014,80,MI,AB,BorderlineSMOTE,MinMax,COMPLETE
40,0.7344229959184103,2025-03-18 12:10:55.192770,2025-03-18 12:12:24.734462,0 days 00:01:29.541692,50,RFE,ETs,SMOTE,MaxAbs,COMPLETE
41,0.801339804701065,2025-03-18 12:10:55.365698,2025-03-18 12:11:21.515921,0 days 00:00:26.150223,80,RFE,RF,SVMSMOTE,MaxAbs,COMPLETE
42,0.0,2025-03-18 12:10:55.491135,2025-03-18 12:11:18.844412,0 days 00:00:23.353277,10,Chi2,MLP,,QT,COMPLETE
43,0.7173530495371352,2025-03-18 12:10:55.616710,2025-03-18 12:12:00.486625,0 days 00:01:04.869915,40,,AB,BorderlineSMOTE,MaxAbs,COMPLETE
44,0.7672356217746031,2025-03-18 12:10:55.758480,2025-03-18 12:12:00.313583,0 days 00:01:04.555103,50,RFE,ETs,SMOTE,MaxAbs,COMPLETE
45,0.796694209014074,2025-03-18 12:10:55.868436,2025-03-18 12:11:54.043779,0 days 00:00:58.175343,40,ANOVA,RF,,Standard,COMPLETE
46,0.7589755549350603,2025-03-18 12:10:55.994000,2025-03-18 12:12:08.099244,0 days 00:01:12.105244,90,RFE,ETs,SMOTE,MaxAbs,COMPLETE
47,0.0,2025-03-18 12:10:56.103871,2025-03-18 12:11:50.604624,0 days 00:00:54.500753,100,RF,ETs,ADASYN,,COMPLETE
48,0.7552465378432485,2025-03-18 12:10:56.245407,2025-03-18 12:12:45.229858,0 days 00:01:48.984451,20,RFE,MLP,BorderlineSMOTE,MaxAbs,COMPLETE
49,0.0,2025-03-18 12:10:56.339737,2025-03-18 12:11:44.568902,0 days 00:00:48.229165,10,RF,DT,,QT,COMPLETE
50,0.7189694264084594,2025-03-18 12:10:57.407645,2025-03-18 12:12:50.085648,0 days 00:01:52.678003,20,RFE,ETs,BorderlineSMOTE,MaxAbs,COMPLETE
51,0.7800031619834148,2025-03-18 12:10:59.402471,2025-03-18 12:12:45.811589,0 days 00:01:46.409118,40,RFE,ETs,BorderlineSMOTE,MaxAbs,COMPLETE
52,0.8094748819132374,2025-03-18 12:11:08.304846,2025-03-18 12:12:50.587657,0 days 00:01:42.282811,40,RFE,RF,,MaxAbs,COMPLETE
53,0.7925505072199934,2025-03-18 12:11:09.498726,2025-03-18 12:12:46.408365,0 days 00:01:36.909639,20,RFE,MLP,BorderlineSMOTE,MaxAbs,COMPLETE
54,0.7474090425701818,2025-03-18 12:11:18.844412,2025-03-18 12:12:53.588017,0 days 00:01:34.743605,20,RFE,ETs,BorderlineSMOTE,MaxAbs,COMPLETE
55,0.7846045281734424,2025-03-18 12:11:23.667700,2025-03-18 12:13:07.940482,0 days 00:01:44.272782,60,,RF,SVMSMOTE,MaxAbs,COMPLETE
56,0.791453411054311,2025-03-18 12:11:39.477897,2025-03-18 12:13:08.238943,0 days 00:01:28.761046,40,RFE,RF,,MaxAbs,COMPLETE
57,0.7391546129161073,2025-03-18 12:11:41.505960,2025-03-18 12:12:46.942295,0 days 00:01:05.436335,40,ANOVA,RF,,Standard,COMPLETE
58,0.7761598401022536,2025-03-18 12:11:45.543268,2025-03-18 12:13:27.891290,0 days 00:01:42.348022,40,ANOVA,RF,,Standard,COMPLETE
59,0.7842879059086987,2025-03-18 12:11:47.241345,2025-03-18 12:12:47.539481,0 days 00:01:00.298136,40,ANOVA,RF,,Standard,COMPLETE
60,0.7765695260631978,2025-03-18 12:11:57.925998,2025-03-18 12:13:07.408052,0 days 00:01:09.482054,80,,RF,SVMSMOTE,MaxAbs,COMPLETE
61,0.76493474356187,2025-03-18 12:11:59.129031,2025-03-18 12:13:20.272006,0 days 00:01:21.142975,40,ANOVA,RF,,Standard,COMPLETE
62,0.7960344195175282,2025-03-18 12:12:05.197183,2025-03-18 12:13:22.895102,0 days 00:01:17.697919,80,,RF,SVMSMOTE,MaxAbs,COMPLETE
63,0.0,2025-03-18 12:12:09.481643,2025-03-18 12:13:08.097304,0 days 00:00:58.615661,60,LDA,RF,SVMSMOTE,Robust,COMPLETE
64,0.801339804701065,2025-03-18 12:12:10.911071,2025-03-18 12:13:46.340712,0 days 00:01:35.429641,80,PCA,SGD,SMOTE,MaxAbs,COMPLETE
65,0.7155801746904663,2025-03-18 12:12:12.827259,2025-03-18 12:13:37.042353,0 days 00:01:24.215094,50,PCA,DT,SMOTE,MaxAbs,COMPLETE
66,0.7556118531276924,2025-03-18 12:12:16.575436,2025-03-18 12:13:05.282979,0 days 00:00:48.707543,20,ANOVA,RF,SVMSMOTE,Standard,COMPLETE
67,0.7845927272467804,2025-03-18 12:12:18.309621,2025-03-18 12:13:33.701006,0 days 00:01:15.391385,50,PCA,SGD,SMOTE,MaxAbs,COMPLETE
68,0.8021447932435777,2025-03-18 12:12:22.440701,2025-03-18 12:13:39.604219,0 days 00:01:17.163518,60,,RF,SVMSMOTE,MaxAbs,COMPLETE
69,0.773152120203847,2025-03-18 12:12:26.414963,2025-03-18 12:13:23.099377,0 days 00:00:56.684414,60,,RF,SVMSMOTE,MaxAbs,COMPLETE
70,0.0,2025-03-18 12:12:27.908605,2025-03-18 12:13:04.341281,0 days 00:00:36.432676,80,LDA,RF,SVMSMOTE,MaxAbs,COMPLETE
71,0.7717188231123213,2025-03-18 12:12:30.170307,2025-03-18 12:13:35.553570,0 days 00:01:05.383263,50,PCA,SGD,SMOTE,MaxAbs,COMPLETE
72,0.7907101240982854,2025-03-18 12:12:31.599936,2025-03-18 12:13:06.715380,0 days 00:00:35.115444,20,,RF,SVMSMOTE,MaxAbs,COMPLETE
73,0.7706992146184636,2025-03-18 12:12:32.887340,2025-03-18 12:13:25.441255,0 days 00:00:52.553915,60,PCA,RF,SVMSMOTE,Robust,COMPLETE
74,0.8116962905485717,2025-03-18 12:12:35.896091,2025-03-18 12:13:20.303257,0 days 00:00:44.407166,60,,RF,SVMSMOTE,MaxAbs,COMPLETE
75,0.787669526457288,2025-03-18 12:12:37.844573,2025-03-18 12:13:26.525168,0 days 00:00:48.680595,80,PCA,RF,SVMSMOTE,MaxAbs,COMPLETE
76,0.7861385421817386,2025-03-18 12:12:39.038775,2025-03-18 12:13:20.774971,0 days 00:00:41.736196,60,,RF,SVMSMOTE,MaxAbs,COMPLETE
77,0.792595804993259,2025-03-18 12:12:39.949480,2025-03-18 12:13:23.099377,0 days 00:00:43.149897,60,,RF,SVMSMOTE,Robust,COMPLETE
78,0.8021447932435777,2025-03-18 12:12:40.655989,2025-03-18 12:13:27.749521,0 days 00:00:47.093532,80,PCA,RF,SMOTE,Robust,COMPLETE
79,0.7907101240982854,2025-03-18 12:12:42.443077,2025-03-18 12:13:10.720445,0 days 00:00:28.277368,60,,RF,SVMSMOTE,Robust,COMPLETE
80,0.739132259753289,2025-03-18 12:12:43.753645,2025-03-18 12:14:03.330066,0 days 00:01:19.576421,80,,SGD,SMOTE,MaxAbs,COMPLETE
81,0.7542648977980908,2025-03-18 12:12:44.711513,2025-03-18 12:13:24.481384,0 days 00:00:39.769871,60,PCA,RF,SVMSMOTE,Robust,COMPLETE
82,0.7869214710676131,2025-03-18 12:12:44.949548,2025-03-18 12:13:25.975689,0 days 00:00:41.026141,60,PCA,RF,SVMSMOTE,Robust,COMPLETE
83,0.7738812285276035,2025-03-18 12:12:45.607287,2025-03-18 12:13:26.289649,0 days 00:00:40.682362,80,PCA,RF,SMOTE,Robust,COMPLETE
84,0.7121349032800659,2025-03-18 12:12:45.984414,2025-03-18 12:13:34.109211,0 days 00:00:48.124797,50,RFE,SGD,SMOTE,MaxAbs,COMPLETE
85,0.8188278041166777,2025-03-18 12:12:46.722675,2025-03-18 12:13:44.157449,0 days 00:00:57.434774,50,RFE,SGD,SMOTE,MaxAbs,COMPLETE
86,0.780891147825351,2025-03-18 12:12:47.304082,2025-03-18 12:13:34.894200,0 days 00:00:47.590118,50,PCA,SGD,SMOTE,MaxAbs,COMPLETE
87,0.749037116471569,2025-03-18 12:12:48.420041,2025-03-18 12:13:35.990018,0 days 00:00:47.569977,60,PCA,SGD,SMOTE,Robust,COMPLETE
88,0.7738812285276035,2025-03-18 12:12:47.319706,2025-03-18 12:13:56.182235,0 days 00:01:08.862529,80,,DT,SVMSMOTE,Robust,COMPLETE
89,0.78481627506094,2025-03-18 12:12:48.781727,2025-03-18 12:13:32.004374,0 days 00:00:43.222647,50,PCA,SGD,SMOTE,MaxAbs,COMPLETE
90,0.8063552163891634,2025-03-18 12:12:49.771541,2025-03-18 12:13:44.507926,0 days 00:00:54.736385,50,PCA,SGD,SMOTE,MaxAbs,COMPLETE
91,0.795591590221368,2025-03-18 12:12:52.441264,2025-03-18 12:13:54.785022,0 days 00:01:02.343758,50,RFE,SGD,SMOTE,MaxAbs,COMPLETE
92,0.8143628325094923,2025-03-18 12:12:53.855490,2025-03-18 12:13:49.301471,0 days 00:00:55.445981,80,,SGD,SMOTE,MaxAbs,COMPLETE
93,0.8108187099600439,2025-03-18 12:12:57.263211,2025-03-18 12:13:51.156529,0 days 00:00:53.893318,80,PCA,SGD,SMOTE,MaxAbs,COMPLETE
94,0.8090248192842948,2025-03-18 12:13:00.319119,2025-03-18 12:13:51.376072,0 days 00:00:51.056953,80,Chi2,SGD,SMOTE,MinMax,COMPLETE
95,0.7801282020794545,2025-03-18 12:13:01.230492,2025-03-18 12:13:35.349518,0 days 00:00:34.119026,50,PCA,SGD,SMOTE,MaxAbs,COMPLETE
96,0.8389273033342306,2025-03-18 12:13:01.685926,2025-03-18 12:13:40.875819,0 days 00:00:39.189893,50,RFE,SGD,SMOTE,MaxAbs,COMPLETE
97,0.7804457857694367,2025-03-18 12:13:02.832150,2025-03-18 12:13:55.946667,0 days 00:00:53.114517,80,,RF,SMOTE,Robust,COMPLETE
98,0.7734910706557497,2025-03-18 12:13:04.073970,2025-03-18 12:13:51.831862,0 days 00:00:47.757892,80,Chi2,SGD,SMOTE,MinMax,COMPLETE
99,0.783924905627504,2025-03-18 12:13:05.157429,2025-03-18 12:14:01.287719,0 days 00:00:56.130290,80,,KNN,SVMSMOTE,Normalizer,COMPLETE
100,0.7645140141537929,2025-03-18 12:13:07.044928,2025-03-18 12:13:46.561248,0 days 00:00:39.516320,80,PCA,RF,SMOTE,Robust,COMPLETE
101,0.7831145936235762,2025-03-18 12:13:07.783108,2025-03-18 12:13:57.563948,0 days 00:00:49.780840,30,,DT,SVMSMOTE,MinMax,COMPLETE
102,0.7663656435194147,2025-03-18 12:13:09.369274,2025-03-18 12:14:10.233837,0 days 00:01:00.864563,30,Chi2,SGD,SMOTE,MinMax,COMPLETE
103,0.8505255922150982,2025-03-18 12:13:09.573479,2025-03-18 12:14:00.346233,0 days 00:00:50.772754,30,,SGD,SMOTE,MaxAbs,COMPLETE
104,0.0,2025-03-18 12:13:09.950573,2025-03-18 12:13:35.553570,0 days 00:00:25.602997,80,Chi2,SGD,SMOTE,,COMPLETE
105,0.7957744563837146,2025-03-18 12:13:18.238415,2025-03-18 12:13:59.997843,0 days 00:00:41.759428,80,,RF,SVMSMOTE,MinMax,COMPLETE
106,0.7671867547082659,2025-03-18 12:13:19.014977,2025-03-18 12:14:19.032863,0 days 00:01:00.017886,30,RFE,SGD,SMOTE,MinMax,COMPLETE
107,0.7722313789057631,2025-03-18 12:13:19.564430,2025-03-18 12:14:04.729046,0 days 00:00:45.164616,80,,KNN,SVMSMOTE,MinMax,COMPLETE
108,0.7955182957457524,2025-03-18 12:13:22.502389,2025-03-18 12:14:06.982699,0 days 00:00:44.480310,80,,KNN,SVMSMOTE,MinMax,COMPLETE
109,0.7818270508431894,2025-03-18 12:13:25.127139,2025-03-18 12:14:12.952573,0 days 00:00:47.825434,30,RFE,SGD,SMOTE,MinMax,COMPLETE
110,0.8171074819179391,2025-03-18 12:13:25.692734,2025-03-18 12:14:09.527069,0 days 00:00:43.834335,30,,SGD,SMOTE,MinMax,COMPLETE
111,0.34369747899170267,2025-03-18 12:13:26.116838,2025-03-18 12:14:04.241957,0 days 00:00:38.125119,90,RFE,SGD,SMOTE,Normalizer,COMPLETE
112,0.0,2025-03-18 12:13:27.153147,2025-03-18 12:14:21.797075,0 days 00:00:54.643928,100,Chi2,SGD,SMOTE,MinMax,COMPLETE
113,0.34369747899170267,2025-03-18 12:13:31.360153,2025-03-18 12:14:05.861374,0 days 00:00:34.501221,30,,SGD,SMOTE,Normalizer,COMPLETE
114,0.7535572506465336,2025-03-18 12:13:31.815909,2025-03-18 12:14:06.621140,0 days 00:00:34.805231,80,,RF,SVMSMOTE,Normalizer,COMPLETE
115,0.753812912921277,2025-03-18 12:13:33.119686,2025-03-18 12:14:04.116375,0 days 00:00:30.996689,90,RFE,SGD,SMOTE,MinMax,COMPLETE
116,0.7101144775524977,2025-03-18 12:13:33.370629,2025-03-18 12:14:23.996279,0 days 00:00:50.625650,30,Chi2,SGD,SMOTE,MinMax,COMPLETE
117,0.7438536404449467,2025-03-18 12:13:33.889568,2025-03-18 12:14:29.841326,0 days 00:00:55.951758,30,RFE,SGD,SMOTE,MinMax,COMPLETE
118,0.8146959356991819,2025-03-18 12:13:35.004195,2025-03-18 12:14:25.128833,0 days 00:00:50.124638,30,Chi2,SGD,SMOTE,MinMax,COMPLETE
119,0.7744422200564941,2025-03-18 12:13:36.634041,2025-03-18 12:14:21.153326,0 days 00:00:44.519285,30,MI,SGD,SMOTE,QT,COMPLETE
120,0.0,2025-03-18 12:13:36.838295,2025-03-18 12:14:06.464404,0 days 00:00:29.626109,30,Chi2,SGD,SMOTE,Normalizer,COMPLETE
121,0.749352209341694,2025-03-18 12:13:39.036987,2025-03-18 12:14:31.742249,0 days 00:00:52.705262,30,Chi2,SGD,SMOTE,MinMax,COMPLETE
122,0.0,2025-03-18 12:13:39.460856,2025-03-18 12:14:22.425087,0 days 00:00:42.964231,100,LDA,SGD,SMOTE,QT,COMPLETE
123,0.0,2025-03-18 12:13:39.896004,2025-03-18 12:14:18.357285,0 days 00:00:38.461281,100,MI,SGD,SMOTE,MaxAbs,COMPLETE
124,0.0,2025-03-18 12:13:40.639875,2025-03-18 12:14:15.498193,0 days 00:00:34.858318,100,MI,SGD,SMOTE,MaxAbs,COMPLETE
125,0.6880767401303409,2025-03-18 12:13:41.237398,2025-03-18 12:15:23.124921,0 days 00:01:41.887523,80,RFE,MLP,,,COMPLETE
126,0.7744496811429763,2025-03-18 12:13:43.749525,2025-03-18 12:14:21.530620,0 days 00:00:37.781095,30,MI,SGD,SMOTE,QT,COMPLETE
127,0.0,2025-03-18 12:13:44.267387,2025-03-18 12:14:31.732682,0 days 00:00:47.465295,30,LDA,SGD,SMOTE,MaxAbs,COMPLETE
128,0.6666251253151467,2025-03-18 12:13:48.862364,2025-03-18 12:14:34.569043,0 days 00:00:45.706679,30,MI,SGD,SMOTE,MinMax,COMPLETE
129,0.0,2025-03-18 12:13:49.474839,2025-03-18 12:14:22.660639,0 days 00:00:33.185800,100,LDA,SGD,SMOTE,QT,COMPLETE
130,0.0,2025-03-18 12:13:50.923550,2025-03-18 12:14:32.401828,0 days 00:00:41.478278,10,LDA,SGD,ADASYN,MaxAbs,COMPLETE
131,0.0,2025-03-18 12:13:52.790466,2025-03-18 12:14:52.722775,0 days 00:00:59.932309,50,RF,AB,,MaxAbs,COMPLETE
132,0.7399128938721315,2025-03-18 12:13:54.833461,2025-03-18 12:14:22.660639,0 days 00:00:27.827178,30,MI,SGD,SMOTE,QT,COMPLETE
133,0.7697829333419474,2025-03-18 12:13:56.559313,2025-03-18 12:14:28.757381,0 days 00:00:32.198068,30,MI,SGD,SMOTE,MaxAbs,COMPLETE
134,0.0,2025-03-18 12:13:57.783815,2025-03-18 12:14:23.980692,0 days 00:00:26.196877,100,MI,SGD,SMOTE,QT,COMPLETE
135,0.0,2025-03-18 12:13:59.809234,2025-03-18 12:14:20.525149,0 days 00:00:20.715915,100,MI,SGD,SMOTE,MaxAbs,COMPLETE
136,0.0,2025-03-18 12:14:00.549714,2025-03-18 12:14:39.759998,0 days 00:00:39.210284,50,RF,ETs,SMOTE,MaxAbs,COMPLETE
137,0.8188459704179237,2025-03-18 12:14:02.135703,2025-03-18 12:15:01.845034,0 days 00:00:59.709331,50,,AB,SMOTE,MaxAbs,COMPLETE
138,0.0,2025-03-18 12:14:02.654585,2025-03-18 12:14:37.717664,0 days 00:00:35.063079,50,RF,AB,SMOTE,MaxAbs,COMPLETE
139,0.7861953776238784,2025-03-18 12:14:02.811457,2025-03-18 12:15:04.206616,0 days 00:01:01.395159,50,,AB,,MaxAbs,COMPLETE
140,0.0,2025-03-18 12:14:03.063256,2025-03-18 12:14:34.066459,0 days 00:00:31.003203,10,LDA,SGD,ADASYN,MaxAbs,COMPLETE
141,0.0,2025-03-18 12:14:03.204503,2025-03-18 12:14:23.352228,0 days 00:00:20.147725,30,LDA,SGD,SMOTE,QT,COMPLETE
142,0.0,2025-03-18 12:14:04.256523,2025-03-18 12:14:39.753440,0 days 00:00:35.496917,50,RF,AB,SMOTE,MaxAbs,COMPLETE
143,0.0,2025-03-18 12:14:04.524808,2025-03-18 12:14:24.531750,0 days 00:00:20.006942,30,LDA,SGD,SMOTE,QT,COMPLETE
144,0.0,2025-03-18 12:14:05.294488,2025-03-18 12:14:52.722775,0 days 00:00:47.428287,10,RF,AB,ADASYN,MaxAbs,COMPLETE
145,0.0,2025-03-18 12:14:05.867405,2025-03-18 12:14:35.150243,0 days 00:00:29.282838,30,LDA,SGD,SMOTE,QT,COMPLETE
146,0.0,2025-03-18 12:14:06.162368,2025-03-18 12:14:27.044600,0 days 00:00:20.882232,10,LDA,SGD,ADASYN,QT,COMPLETE
147,0.0,2025-03-18 12:14:06.363076,2025-03-18 12:14:37.230140,0 days 00:00:30.867064,10,Chi2,SGD,ADASYN,MaxAbs,COMPLETE
148,0.0,2025-03-18 12:14:06.715467,2025-03-18 12:14:39.241276,0 days 00:00:32.525809,50,RF,ETs,SMOTE,MaxAbs,COMPLETE
149,0.0,2025-03-18 12:14:06.864216,2025-03-18 12:15:02.123293,0 days 00:00:55.259077,50,RF,AB,,MaxAbs,COMPLETE
150,0.6880767401303409,2025-03-18 12:14:09.322931,2025-03-18 12:15:12.575368,0 days 00:01:03.252437,70,RFE,MLP,,,COMPLETE
151,0.0,2025-03-18 12:14:11.443366,2025-03-18 12:14:35.056030,0 days 00:00:23.612664,10,RF,SGD,SMOTE,MaxAbs,COMPLETE
152,0.0,2025-03-18 12:14:11.553277,2025-03-18 12:14:35.322620,0 days 00:00:23.769343,10,Chi2,AB,ADASYN,MaxAbs,COMPLETE
153,0.7722736782191457,2025-03-18 12:14:13.204110,2025-03-18 12:15:04.913351,0 days 00:00:51.709241,50,RFE,ETs,,MaxAbs,COMPLETE
154,0.7583027765638384,2025-03-18 12:14:16.220824,2025-03-18 12:15:07.091766,0 days 00:00:50.870942,50,RFE,ETs,,MaxAbs,COMPLETE
155,0.7449073905134336,2025-03-18 12:14:16.377664,2025-03-18 12:15:02.583292,0 days 00:00:46.205628,50,RFE,ETs,,MaxAbs,COMPLETE
156,0.7823712860610359,2025-03-18 12:14:17.586630,2025-03-18 12:15:14.745658,0 days 00:00:57.159028,50,RFE,ETs,,,COMPLETE
157,0.34369747899170267,2025-03-18 12:14:18.357285,2025-03-18 12:15:16.127164,0 days 00:00:57.769879,70,RFE,MLP,,,COMPLETE
158,0.0,2025-03-18 12:14:18.718923,2025-03-18 12:15:07.390203,0 days 00:00:48.671280,50,RF,ETs,,MaxAbs,COMPLETE
159,0.7707944377577658,2025-03-18 12:14:18.859993,2025-03-18 12:15:14.557530,0 days 00:00:55.697537,70,RFE,MLP,,MaxAbs,COMPLETE
160,0.7636029854255255,2025-03-18 12:14:20.760638,2025-03-18 12:15:27.758842,0 days 00:01:06.998204,70,RFE,MLP,,MaxAbs,COMPLETE
161,0.7768596868027627,2025-03-18 12:14:20.917844,2025-03-18 12:15:09.636254,0 days 00:00:48.718410,70,RFE,RF,,,COMPLETE
162,0.7780864583348404,2025-03-18 12:14:21.326358,2025-03-18 12:15:22.387396,0 days 00:01:01.061038,70,RFE,MLP,,MaxAbs,COMPLETE
163,0.7939120230389843,2025-03-18 12:14:21.530620,2025-03-18 12:15:50.259999,0 days 00:01:28.729379,80,PCA,RF,SMOTE,MaxAbs,COMPLETE
164,0.7811841858330595,2025-03-18 12:14:23.619714,2025-03-18 12:15:31.718510,0 days 00:01:08.098796,80,,RF,SMOTE,MaxAbs,COMPLETE
165,0.7800031619834148,2025-03-18 12:14:23.760936,2025-03-18 12:15:34.285734,0 days 00:01:10.524798,80,PCA,RF,SMOTE,MaxAbs,COMPLETE
166,0.6880767401303409,2025-03-18 12:14:25.647108,2025-03-18 12:15:41.560289,0 days 00:01:15.913181,80,RFE,MLP,,,COMPLETE
167,0.7652489052264024,2025-03-18 12:14:26.055538,2025-03-18 12:15:28.764696,0 days 00:01:02.709158,70,,RF,SMOTE,,COMPLETE
168,0.6880767401303409,2025-03-18 12:14:29.071373,2025-03-18 12:15:33.906445,0 days 00:01:04.835072,70,RFE,MLP,,,COMPLETE
169,0.7802034485903808,2025-03-18 12:14:32.684606,2025-03-18 12:15:17.807113,0 days 00:00:45.122507,70,RFE,RF,,,COMPLETE
