number,value,datetime_start,datetime_complete,duration,params_FS Ratio,params_FS Tech,params_Model,params_OV Tech,params_Scaler,state
497,0.7927953766660982,2025-03-18 12:08:16.168304,2025-03-18 12:09:17.090928,0 days 00:01:00.922624,50,PCA,MLP,SVMSMOTE,Robust,COMPLETE
498,0.7726626464551076,2025-03-18 12:08:18.502000,2025-03-18 12:09:25.961406,0 days 00:01:07.459406,50,,MLP,SVMSMOTE,Robust,COMPLETE
499,0.814427144019682,2025-03-18 12:08:23.042695,2025-03-18 12:09:20.838805,0 days 00:00:57.796110,50,PCA,MLP,SVMSMOTE,Robust,COMPLETE
