number,value,datetime_start,datetime_complete,duration,params_FS Ratio,params_FS Tech,params_Model,params_OV Tech,params_Scaler,state
0,0.34285714285724567,2025-03-18 11:38:22.922521,2025-03-18 11:39:05.855975,0 days 00:00:42.933454,10,RF,SGD,SMOTE,,COMPLETE
1,0.7017179309980057,2025-03-18 11:38:23.207818,2025-03-18 11:38:54.960644,0 days 00:00:31.752826,70,Chi2,KNN,SMOTE,MinMax,COMPLETE
2,0.7515185085945031,2025-03-18 11:38:23.477610,2025-03-18 11:38:45.887582,0 days 00:00:22.409972,30,,AB,,MinMax,COMPLETE
3,0.7017459606806253,2025-03-18 11:38:23.618672,2025-03-18 11:38:47.195186,0 days 00:00:23.576514,80,PCA,MLP,BorderlineSMOTE,Standard,COMPLETE
4,0.7499767094035841,2025-03-18 11:38:23.712894,2025-03-18 11:39:19.537181,0 days 00:00:55.824287,90,ANOVA,AB,,QT,COMPLETE
5,0.34285714285724567,2025-03-18 11:38:23.838373,2025-03-18 11:39:21.974514,0 days 00:00:58.136141,80,MI,ETs,ADASYN,,COMPLETE
6,0.0,2025-03-18 11:38:23.963903,2025-03-18 11:39:06.536593,0 days 00:00:42.572690,100,PCA,KNN,SMOTE,QT,COMPLETE
7,0.6902857142860689,2025-03-18 11:38:24.152047,2025-03-18 11:38:57.808586,0 days 00:00:33.656539,10,,MLP,,MinMax,COMPLETE
8,0.7190628474760965,2025-03-18 11:38:24.277530,2025-03-18 11:38:55.447688,0 days 00:00:31.170158,50,PCA,KNN,BorderlineSMOTE,Standard,COMPLETE
9,0.7396018858366374,2025-03-18 11:38:24.387378,2025-03-18 11:38:47.484104,0 days 00:00:23.096726,90,ANOVA,MLP,SMOTE,QT,COMPLETE
10,0.6946058366921475,2025-03-18 11:38:24.513279,2025-03-18 11:39:04.341390,0 days 00:00:39.828111,70,RFE,RF,SVMSMOTE,QT,COMPLETE
11,0.5567675031846501,2025-03-18 11:38:24.701764,2025-03-18 11:39:19.787499,0 days 00:00:55.085735,10,Chi2,SGD,SMOTE,MinMax,COMPLETE
12,0.7102826723577469,2025-03-18 11:38:24.842938,2025-03-18 11:39:21.759795,0 days 00:00:56.916857,70,ANOVA,AB,,Robust,COMPLETE
13,0.0,2025-03-18 11:38:24.999786,2025-03-18 11:39:20.741932,0 days 00:00:55.742146,100,MI,AB,SVMSMOTE,Robust,COMPLETE
14,0.0,2025-03-18 11:38:25.112214,2025-03-18 11:38:49.732454,0 days 00:00:24.620240,20,Chi2,RF,ADASYN,,COMPLETE
15,0.0,2025-03-18 11:38:25.251324,2025-03-18 11:39:18.396971,0 days 00:00:53.145647,20,RF,KNN,,MaxAbs,COMPLETE
16,0.707555449095209,2025-03-18 11:38:25.424253,2025-03-18 11:38:48.085296,0 days 00:00:22.661043,30,MI,RF,BorderlineSMOTE,Robust,COMPLETE
17,0.0,2025-03-18 11:38:25.549882,2025-03-18 11:38:59.535156,0 days 00:00:33.985274,100,RF,SGD,BorderlineSMOTE,MinMax,COMPLETE
18,0.34285714285724567,2025-03-18 11:38:25.722845,2025-03-18 11:39:16.408819,0 days 00:00:50.685974,20,ANOVA,MLP,BorderlineSMOTE,,COMPLETE
19,0.6902857142860689,2025-03-18 11:38:25.895288,2025-03-18 11:39:21.307644,0 days 00:00:55.412356,90,ANOVA,AB,,MaxAbs,COMPLETE
20,0.34285714285724567,2025-03-18 11:38:26.052515,2025-03-18 11:38:49.497093,0 days 00:00:23.444578,80,MI,SGD,BorderlineSMOTE,Normalizer,COMPLETE
21,0.6902857142860689,2025-03-18 11:38:26.209226,2025-03-18 11:39:28.743452,0 days 00:01:02.534226,90,ANOVA,ETs,,MaxAbs,COMPLETE
22,0.0,2025-03-18 11:38:26.350884,2025-03-18 11:39:28.146242,0 days 00:01:01.795358,60,LDA,KNN,ADASYN,Standard,COMPLETE
23,0.0,2025-03-18 11:38:26.460789,2025-03-18 11:39:40.057813,0 days 00:01:13.597024,60,LDA,MLP,SMOTE,QT,COMPLETE
24,0.6902857142860689,2025-03-18 11:38:26.586302,2025-03-18 11:39:16.213639,0 days 00:00:49.627337,30,PCA,MLP,SVMSMOTE,Normalizer,COMPLETE
25,0.637736732055229,2025-03-18 11:38:26.711775,2025-03-18 11:38:53.803798,0 days 00:00:27.092023,30,PCA,SGD,SVMSMOTE,MinMax,COMPLETE
26,0.6864127151918776,2025-03-18 11:38:26.837614,2025-03-18 11:38:54.741671,0 days 00:00:27.904057,50,,DT,BorderlineSMOTE,Robust,COMPLETE
27,0.7144368929863489,2025-03-18 11:38:26.947568,2025-03-18 11:39:18.538174,0 days 00:00:51.590606,90,ANOVA,AB,,QT,COMPLETE
28,0.6902857142860689,2025-03-18 11:38:27.057532,2025-03-18 11:39:37.855645,0 days 00:01:10.798113,90,ANOVA,ETs,,MaxAbs,COMPLETE
29,0.7182761483058179,2025-03-18 11:38:27.292993,2025-03-18 11:39:18.915214,0 days 00:00:51.622221,90,ANOVA,AB,SMOTE,QT,COMPLETE
30,0.6702174502941628,2025-03-18 11:38:27.418842,2025-03-18 11:39:34.203353,0 days 00:01:06.784511,60,,MLP,SMOTE,QT,COMPLETE
31,0.7135355175129149,2025-03-18 11:38:27.622968,2025-03-18 11:39:13.320814,0 days 00:00:45.697846,80,ANOVA,AB,SMOTE,Robust,COMPLETE
32,0.6356579523247263,2025-03-18 11:38:27.779804,2025-03-18 11:39:16.665925,0 days 00:00:48.886121,20,RFE,DT,BorderlineSMOTE,MaxAbs,COMPLETE
33,0.6834607653234102,2025-03-18 11:38:27.968380,2025-03-18 11:39:11.797700,0 days 00:00:43.829320,40,RFE,RF,ADASYN,MinMax,COMPLETE
34,0.0,2025-03-18 11:38:28.093821,2025-03-18 11:39:03.640970,0 days 00:00:35.547149,80,Chi2,AB,,Robust,COMPLETE
35,0.6902857142860689,2025-03-18 11:38:28.360293,2025-03-18 11:39:31.260909,0 days 00:01:02.900616,90,ANOVA,ETs,,MaxAbs,COMPLETE
36,0.0,2025-03-18 11:38:29.072728,2025-03-18 11:39:36.969477,0 days 00:01:07.896749,60,LDA,ETs,SMOTE,QT,COMPLETE
37,0.7144368929863489,2025-03-18 11:38:28.125493,2025-03-18 11:39:18.522549,0 days 00:00:50.397056,90,ANOVA,AB,,QT,COMPLETE
38,0.6596754886526713,2025-03-18 11:38:29.499282,2025-03-18 11:39:12.488328,0 days 00:00:42.989046,30,MI,SGD,SMOTE,QT,COMPLETE
39,0.763296991784686,2025-03-18 11:38:29.678998,2025-03-18 11:39:19.371450,0 days 00:00:49.692452,90,ANOVA,AB,SMOTE,QT,COMPLETE
40,0.7190622920663674,2025-03-18 11:38:30.122439,2025-03-18 11:39:49.139860,0 days 00:01:19.017421,10,,AB,ADASYN,MinMax,COMPLETE
41,0.7314799783547619,2025-03-18 11:38:31.294925,2025-03-18 11:39:41.720761,0 days 00:01:10.425836,60,,MLP,SMOTE,QT,COMPLETE
42,0.0,2025-03-18 11:38:32.543140,2025-03-18 11:39:10.886616,0 days 00:00:38.343476,40,RF,RF,,Normalizer,COMPLETE
43,0.6870103686636709,2025-03-18 11:38:33.109695,2025-03-18 11:39:29.387202,0 days 00:00:56.277507,90,ANOVA,ETs,SMOTE,QT,COMPLETE
44,0.6834302338961784,2025-03-18 11:38:33.411470,2025-03-18 11:39:55.557385,0 days 00:01:22.145915,10,,AB,SMOTE,Standard,COMPLETE
45,0.0,2025-03-18 11:38:33.709718,2025-03-18 11:39:32.433967,0 days 00:00:58.724249,60,LDA,MLP,SMOTE,QT,COMPLETE
46,0.7263024378265384,2025-03-18 11:38:37.658380,2025-03-18 11:39:17.706315,0 days 00:00:40.047935,90,ANOVA,AB,,QT,COMPLETE
47,0.7186157983718557,2025-03-18 11:38:38.903961,2025-03-18 11:39:30.127454,0 days 00:00:51.223493,90,ANOVA,AB,,QT,COMPLETE
48,0.7031249062301239,2025-03-18 11:38:39.135042,2025-03-18 11:39:31.583986,0 days 00:00:52.448944,60,,MLP,SMOTE,QT,COMPLETE
49,0.6902857142860689,2025-03-18 11:38:40.011272,2025-03-18 11:39:28.978789,0 days 00:00:48.967517,90,ANOVA,ETs,,MaxAbs,COMPLETE
50,0.0,2025-03-18 11:38:44.614503,2025-03-18 11:39:31.978122,0 days 00:00:47.363619,60,LDA,MLP,SMOTE,QT,COMPLETE
51,0.0,2025-03-18 11:38:45.639641,2025-03-18 11:39:32.119904,0 days 00:00:46.480263,60,LDA,MLP,SMOTE,QT,COMPLETE
52,0.6902857142860689,2025-03-18 11:38:47.099300,2025-03-18 11:39:22.084315,0 days 00:00:34.985015,90,ANOVA,ETs,,MaxAbs,COMPLETE
53,0.6902857142860689,2025-03-18 11:38:51.400649,2025-03-18 11:39:29.748629,0 days 00:00:38.347980,90,ANOVA,ETs,,MaxAbs,COMPLETE
54,0.7685335365578483,2025-03-18 11:39:10.006861,2025-03-18 11:39:41.072731,0 days 00:00:31.065870,10,,AB,SMOTE,QT,COMPLETE
55,0.6569969246439801,2025-03-18 11:39:10.243282,2025-03-18 11:39:55.305932,0 days 00:00:45.062650,10,,AB,SMOTE,Standard,COMPLETE
56,0.6756401931400043,2025-03-18 11:39:11.797700,2025-03-18 11:39:59.291931,0 days 00:00:47.494231,60,,MLP,SMOTE,QT,COMPLETE
57,0.7256979446726846,2025-03-18 11:39:14.657240,2025-03-18 11:39:47.465145,0 days 00:00:32.807905,10,,AB,ADASYN,MinMax,COMPLETE
58,0.7206748041494342,2025-03-18 11:39:17.077123,2025-03-18 11:39:42.522246,0 days 00:00:25.445123,10,,AB,SMOTE,MinMax,COMPLETE
59,0.34285714285724567,2025-03-18 11:39:17.863071,2025-03-18 11:40:13.141115,0 days 00:00:55.278044,30,,DT,SVMSMOTE,,COMPLETE
60,0.672682290715799,2025-03-18 11:39:20.631534,2025-03-18 11:39:59.574574,0 days 00:00:38.943040,50,PCA,AB,BorderlineSMOTE,MinMax,COMPLETE
61,0.7023403251785313,2025-03-18 11:39:20.977964,2025-03-18 11:39:51.307436,0 days 00:00:30.329472,10,,AB,ADASYN,Standard,COMPLETE
62,0.7223756216649445,2025-03-18 11:39:21.158496,2025-03-18 11:39:52.814779,0 days 00:00:31.656283,10,,AB,ADASYN,Standard,COMPLETE
63,0.7027032128765685,2025-03-18 11:39:21.524815,2025-03-18 11:39:59.025285,0 days 00:00:37.500470,10,,AB,SMOTE,Standard,COMPLETE
64,0.0,2025-03-18 11:39:22.225451,2025-03-18 11:40:11.735068,0 days 00:00:49.509617,70,Chi2,KNN,SVMSMOTE,,COMPLETE
65,0.7190097601783998,2025-03-18 11:39:23.507424,2025-03-18 11:40:01.168329,0 days 00:00:37.660905,10,,AB,SMOTE,Standard,COMPLETE
66,0.6631184595755565,2025-03-18 11:39:27.691186,2025-03-18 11:40:28.430156,0 days 00:01:00.738970,70,,KNN,SVMSMOTE,,COMPLETE
67,0.7245478373130825,2025-03-18 11:39:29.167359,2025-03-18 11:39:56.923966,0 days 00:00:27.756607,10,,AB,SMOTE,Standard,COMPLETE
68,0.7190628474760965,2025-03-18 11:39:29.575588,2025-03-18 11:40:19.884062,0 days 00:00:50.308474,70,,KNN,SMOTE,QT,COMPLETE
69,0.6971180410283359,2025-03-18 11:39:30.347136,2025-03-18 11:40:06.384551,0 days 00:00:36.037415,70,,KNN,SMOTE,Standard,COMPLETE
70,0.7212839885966877,2025-03-18 11:39:31.400390,2025-03-18 11:40:12.968176,0 days 00:00:41.567786,70,,AB,SMOTE,Standard,COMPLETE
71,0.7263165983007246,2025-03-18 11:39:32.104213,2025-03-18 11:39:55.132888,0 days 00:00:23.028675,10,,AB,SMOTE,Standard,COMPLETE
72,0.7161315299135765,2025-03-18 11:39:34.470207,2025-03-18 11:40:08.550451,0 days 00:00:34.080244,70,,KNN,SMOTE,,COMPLETE
73,0.7027032128765685,2025-03-18 11:39:34.601722,2025-03-18 11:40:11.847004,0 days 00:00:37.245282,70,,KNN,SMOTE,QT,COMPLETE
74,0.6898535356637455,2025-03-18 11:39:35.103365,2025-03-18 11:40:12.365342,0 days 00:00:37.261977,70,,KNN,SVMSMOTE,,COMPLETE
75,0.0,2025-03-18 11:39:35.365470,2025-03-18 11:40:11.988143,0 days 00:00:36.622673,70,RF,KNN,SVMSMOTE,QT,COMPLETE
76,0.7091274483706983,2025-03-18 11:39:35.590830,2025-03-18 11:40:37.777073,0 days 00:01:02.186243,30,RFE,DT,SVMSMOTE,QT,COMPLETE
77,0.7242767640720147,2025-03-18 11:39:35.763881,2025-03-18 11:40:05.996498,0 days 00:00:30.232617,10,,AB,SMOTE,Standard,COMPLETE
78,0.0,2025-03-18 11:39:37.101931,2025-03-18 11:40:20.794719,0 days 00:00:43.692788,70,Chi2,KNN,SVMSMOTE,,COMPLETE
79,0.7122595880071844,2025-03-18 11:39:37.709461,2025-03-18 11:40:57.789193,0 days 00:01:20.079732,90,ANOVA,AB,ADASYN,MinMax,COMPLETE
80,0.7271282432426411,2025-03-18 11:39:38.812464,2025-03-18 11:40:13.893960,0 days 00:00:35.081496,70,,KNN,SMOTE,Standard,COMPLETE
81,0.7256382743561969,2025-03-18 11:39:39.868765,2025-03-18 11:40:14.549026,0 days 00:00:34.680261,70,,KNN,SMOTE,,COMPLETE
82,0.0,2025-03-18 11:39:40.272060,2025-03-18 11:40:11.000498,0 days 00:00:30.728438,70,Chi2,KNN,SMOTE,,COMPLETE
83,0.0,2025-03-18 11:39:40.476424,2025-03-18 11:40:26.435611,0 days 00:00:45.959187,100,Chi2,DT,SVMSMOTE,,COMPLETE
84,0.0,2025-03-18 11:39:41.355455,2025-03-18 11:40:21.823896,0 days 00:00:40.468441,70,Chi2,KNN,SVMSMOTE,,COMPLETE
85,0.6707644012429664,2025-03-18 11:39:41.905485,2025-03-18 11:40:27.064833,0 days 00:00:45.159348,70,,KNN,SMOTE,,COMPLETE
86,0.0,2025-03-18 11:39:42.206803,2025-03-18 11:40:45.346819,0 days 00:01:03.140016,30,Chi2,KNN,SVMSMOTE,,COMPLETE
87,0.7241844350545404,2025-03-18 11:39:42.347825,2025-03-18 11:40:48.096400,0 days 00:01:05.748575,90,ANOVA,AB,ADASYN,MinMax,COMPLETE
88,0.0,2025-03-18 11:39:43.339390,2025-03-18 11:40:18.862160,0 days 00:00:35.522770,100,Chi2,MLP,SVMSMOTE,,COMPLETE
89,0.0,2025-03-18 11:39:44.360607,2025-03-18 11:40:24.831838,0 days 00:00:40.471231,100,Chi2,MLP,SMOTE,,COMPLETE
90,0.0,2025-03-18 11:39:44.815818,2025-03-18 11:40:45.488335,0 days 00:01:00.672517,100,MI,MLP,SMOTE,Normalizer,COMPLETE
91,0.6902857142860689,2025-03-18 11:39:45.067572,2025-03-18 11:40:36.566674,0 days 00:00:51.499102,90,ANOVA,SGD,,Normalizer,COMPLETE
92,0.6902857142860689,2025-03-18 11:39:45.531251,2025-03-18 11:40:45.205699,0 days 00:00:59.674448,90,ANOVA,SGD,,QT,COMPLETE
93,0.0,2025-03-18 11:39:45.695175,2025-03-18 11:40:26.710726,0 days 00:00:41.015551,100,RFE,MLP,SMOTE,QT,COMPLETE
94,0.0,2025-03-18 11:39:46.703877,2025-03-18 11:40:31.268070,0 days 00:00:44.564193,100,RFE,MLP,SMOTE,QT,COMPLETE
95,0.0,2025-03-18 11:39:47.166576,2025-03-18 11:40:20.684945,0 days 00:00:33.518369,100,Chi2,DT,SMOTE,,COMPLETE
96,0.0,2025-03-18 11:39:49.684875,2025-03-18 11:40:28.948816,0 days 00:00:39.263941,100,RFE,MLP,,QT,COMPLETE
97,0.6902857142860689,2025-03-18 11:39:49.982685,2025-03-18 11:40:39.271145,0 days 00:00:49.288460,90,ANOVA,SGD,,Normalizer,COMPLETE
98,0.0,2025-03-18 11:39:50.485439,2025-03-18 11:40:24.134603,0 days 00:00:33.649164,100,RFE,MLP,,QT,COMPLETE
99,0.0,2025-03-18 11:39:53.992664,2025-03-18 11:40:29.906151,0 days 00:00:35.913487,100,RFE,MLP,SMOTE,Normalizer,COMPLETE
100,0.7031637941966382,2025-03-18 11:39:54.811436,2025-03-18 11:40:41.436821,0 days 00:00:46.625385,90,ANOVA,AB,ADASYN,MinMax,COMPLETE
101,0.0,2025-03-18 11:39:55.682919,2025-03-18 11:40:22.445941,0 days 00:00:26.763022,100,RFE,MLP,,QT,COMPLETE
102,0.7424109181513578,2025-03-18 11:39:57.909845,2025-03-18 11:40:44.938363,0 days 00:00:47.028518,90,RFE,SGD,,QT,COMPLETE
103,0.34285714285724567,2025-03-18 11:40:02.697663,2025-03-18 11:40:30.283417,0 days 00:00:27.585754,30,MI,SGD,SMOTE,Normalizer,COMPLETE
104,0.6902857142860689,2025-03-18 11:40:03.727974,2025-03-18 11:40:39.271145,0 days 00:00:35.543171,90,ANOVA,RF,,Normalizer,COMPLETE
105,0.6902857142860689,2025-03-18 11:40:05.092685,2025-03-18 11:40:39.897758,0 days 00:00:34.805073,90,RFE,SGD,,QT,COMPLETE
106,0.6591142298560929,2025-03-18 11:40:06.240333,2025-03-18 11:40:48.300557,0 days 00:00:42.060224,90,ANOVA,AB,ADASYN,MinMax,COMPLETE
107,0.733210457900547,2025-03-18 11:40:07.717210,2025-03-18 11:40:45.756599,0 days 00:00:38.039389,90,ANOVA,AB,ADASYN,MinMax,COMPLETE
108,0.735359740371371,2025-03-18 11:40:09.116209,2025-03-18 11:40:50.197917,0 days 00:00:41.081708,90,ANOVA,AB,ADASYN,MinMax,COMPLETE
109,0.735359740371371,2025-03-18 11:40:10.670564,2025-03-18 11:41:36.327158,0 days 00:01:25.656594,90,ANOVA,AB,ADASYN,Robust,COMPLETE
110,0.7271282432426411,2025-03-18 11:40:17.526017,2025-03-18 11:40:43.376867,0 days 00:00:25.850850,90,ANOVA,AB,ADASYN,MinMax,COMPLETE
111,0.6810039685730741,2025-03-18 11:40:17.824442,2025-03-18 11:40:49.108259,0 days 00:00:31.283817,90,ANOVA,AB,ADASYN,MinMax,COMPLETE
112,0.7336038961036965,2025-03-18 11:40:18.752219,2025-03-18 11:40:53.804338,0 days 00:00:35.052119,90,ANOVA,AB,ADASYN,MinMax,COMPLETE
113,0.747111367112811,2025-03-18 11:40:19.868434,2025-03-18 11:41:13.193681,0 days 00:00:53.325247,90,ANOVA,AB,ADASYN,MinMax,COMPLETE
114,0.6722873804489111,2025-03-18 11:40:20.135509,2025-03-18 11:40:52.424015,0 days 00:00:32.288506,50,ANOVA,AB,BorderlineSMOTE,MinMax,COMPLETE
115,0.0,2025-03-18 11:40:20.261093,2025-03-18 11:40:57.365241,0 days 00:00:37.104148,40,RF,AB,ADASYN,MinMax,COMPLETE
116,0.6535421728851804,2025-03-18 11:40:20.434062,2025-03-18 11:40:54.649445,0 days 00:00:34.215383,20,ANOVA,AB,ADASYN,MinMax,COMPLETE
117,0.599388515036247,2025-03-18 11:40:21.623533,2025-03-18 11:41:13.853409,0 days 00:00:52.229876,20,PCA,AB,ADASYN,MinMax,COMPLETE
118,0.6779025712848412,2025-03-18 11:40:21.994360,2025-03-18 11:41:09.903248,0 days 00:00:47.908888,40,ANOVA,AB,ADASYN,MinMax,COMPLETE
119,0.5840205733050476,2025-03-18 11:40:23.757538,2025-03-18 11:40:55.120805,0 days 00:00:31.363267,40,ANOVA,AB,ADASYN,MinMax,COMPLETE
120,0.7433594878222796,2025-03-18 11:40:25.893721,2025-03-18 11:40:51.418094,0 days 00:00:25.524373,90,ANOVA,AB,ADASYN,MinMax,COMPLETE
121,0.743171364239615,2025-03-18 11:40:26.238911,2025-03-18 11:41:28.825965,0 days 00:01:02.587054,90,ANOVA,AB,,QT,COMPLETE
122,0.0,2025-03-18 11:40:26.836799,2025-03-18 11:41:03.430118,0 days 00:00:36.593319,80,RF,AB,ADASYN,MinMax,COMPLETE
123,0.7399675324673818,2025-03-18 11:40:27.661422,2025-03-18 11:41:22.868883,0 days 00:00:55.207461,90,ANOVA,AB,ADASYN,Robust,COMPLETE
124,0.6485839929605689,2025-03-18 11:40:27.802048,2025-03-18 11:41:00.303282,0 days 00:00:32.501234,40,PCA,AB,ADASYN,MinMax,COMPLETE
125,0.5951899385721401,2025-03-18 11:40:28.242140,2025-03-18 11:40:52.842354,0 days 00:00:24.600214,20,PCA,AB,ADASYN,MinMax,COMPLETE
126,0.6371442265087203,2025-03-18 11:40:28.587481,2025-03-18 11:41:04.215702,0 days 00:00:35.628221,40,ANOVA,AB,ADASYN,MinMax,COMPLETE
127,0.6626699048485003,2025-03-18 11:40:29.529712,2025-03-18 11:41:04.689891,0 days 00:00:35.160179,40,ANOVA,AB,ADASYN,MinMax,COMPLETE
128,0.6202339181284751,2025-03-18 11:40:30.141699,2025-03-18 11:41:05.712974,0 days 00:00:35.571275,40,ANOVA,AB,ADASYN,MinMax,COMPLETE
129,0.6840432819366977,2025-03-18 11:40:32.652636,2025-03-18 11:41:23.578481,0 days 00:00:50.925845,90,ANOVA,RF,ADASYN,QT,COMPLETE
130,0.7004329004330009,2025-03-18 11:40:34.016733,2025-03-18 11:41:14.714866,0 days 00:00:40.698133,80,ANOVA,RF,ADASYN,Robust,COMPLETE
131,0.0,2025-03-18 11:40:34.644919,2025-03-18 11:41:15.750772,0 days 00:00:41.105853,80,RF,AB,ADASYN,Robust,COMPLETE
132,0.7493074403748653,2025-03-18 11:40:34.833462,2025-03-18 11:41:23.578481,0 days 00:00:48.745019,90,ANOVA,RF,ADASYN,Robust,COMPLETE
133,0.7160452292803852,2025-03-18 11:40:35.053385,2025-03-18 11:41:33.591040,0 days 00:00:58.537655,90,ANOVA,AB,BorderlineSMOTE,Robust,COMPLETE
134,0.7256360953861337,2025-03-18 11:40:36.268233,2025-03-18 11:41:31.250932,0 days 00:00:54.982699,90,ANOVA,RF,ADASYN,Robust,COMPLETE
135,0.7264729637048375,2025-03-18 11:40:36.425017,2025-03-18 11:41:39.512090,0 days 00:01:03.087073,90,ANOVA,AB,ADASYN,QT,COMPLETE
136,0.7104647672127433,2025-03-18 11:40:40.023340,2025-03-18 11:41:13.020700,0 days 00:00:32.997360,80,ANOVA,RF,ADASYN,MinMax,COMPLETE
137,0.7337719614384101,2025-03-18 11:40:43.220129,2025-03-18 11:41:18.796827,0 days 00:00:35.576698,80,ANOVA,AB,ADASYN,Robust,COMPLETE
138,0.7059581413210779,2025-03-18 11:40:43.393012,2025-03-18 11:41:25.176926,0 days 00:00:41.783914,90,ANOVA,RF,ADASYN,Robust,COMPLETE
139,0.0,2025-03-18 11:40:44.907110,2025-03-18 11:41:22.606777,0 days 00:00:37.699667,90,LDA,AB,BorderlineSMOTE,QT,COMPLETE
140,0.7191558441559022,2025-03-18 11:40:47.202546,2025-03-18 11:41:22.606777,0 days 00:00:35.404231,80,ANOVA,RF,ADASYN,QT,COMPLETE
141,0.6929132954605699,2025-03-18 11:40:47.406806,2025-03-18 11:41:22.465320,0 days 00:00:35.058514,90,ANOVA,RF,ADASYN,Robust,COMPLETE
142,0.7101176811402025,2025-03-18 11:40:47.799332,2025-03-18 11:41:36.342780,0 days 00:00:48.543448,80,ANOVA,AB,ADASYN,Robust,COMPLETE
143,0.6922966464568854,2025-03-18 11:40:47.939058,2025-03-18 11:41:37.101409,0 days 00:00:49.162351,90,ANOVA,AB,ADASYN,Robust,COMPLETE
144,0.6799263849306778,2025-03-18 11:40:51.251210,2025-03-18 11:41:20.601724,0 days 00:00:29.350514,90,ANOVA,RF,ADASYN,QT,COMPLETE
145,0.691976946722594,2025-03-18 11:40:53.769061,2025-03-18 11:41:30.402375,0 days 00:00:36.633314,90,ANOVA,AB,BorderlineSMOTE,QT,COMPLETE
146,0.7614149008886829,2025-03-18 11:40:53.046635,2025-03-18 11:41:51.526515,0 days 00:00:58.479880,90,ANOVA,AB,,Robust,COMPLETE
147,0.6902857142860689,2025-03-18 11:40:54.271539,2025-03-18 11:41:51.934953,0 days 00:00:57.663414,30,MI,SGD,,Robust,COMPLETE
148,0.639498611657659,2025-03-18 11:40:54.869196,2025-03-18 11:41:31.481482,0 days 00:00:36.612286,90,ANOVA,AB,BorderlineSMOTE,Robust,COMPLETE
149,0.7542915417916749,2025-03-18 11:40:56.580529,2025-03-18 11:42:21.763043,0 days 00:01:25.182514,90,ANOVA,AB,,Robust,COMPLETE
150,0.0,2025-03-18 11:40:57.522520,2025-03-18 11:41:31.450164,0 days 00:00:33.927644,90,LDA,AB,BorderlineSMOTE,QT,COMPLETE
151,0.7940599033178268,2025-03-18 11:40:57.648027,2025-03-18 11:42:04.648601,0 days 00:01:07.000574,90,ANOVA,AB,BorderlineSMOTE,Robust,COMPLETE
152,0.7165410368450226,2025-03-18 11:40:58.795406,2025-03-18 11:41:44.183408,0 days 00:00:45.388002,90,ANOVA,AB,,Robust,COMPLETE
153,0.7206748041494342,2025-03-18 11:40:59.172363,2025-03-18 11:41:36.186055,0 days 00:00:37.013692,90,ANOVA,AB,ADASYN,Robust,COMPLETE
154,0.6852347622690302,2025-03-18 11:41:00.429348,2025-03-18 11:41:38.114046,0 days 00:00:37.684698,90,ANOVA,AB,ADASYN,Robust,COMPLETE
155,0.7424191940079234,2025-03-18 11:41:02.863343,2025-03-18 11:41:55.314386,0 days 00:00:52.451043,90,ANOVA,AB,,Robust,COMPLETE
156,0.7788780663778272,2025-03-18 11:41:03.067480,2025-03-18 11:41:40.204578,0 days 00:00:37.137098,90,ANOVA,AB,ADASYN,Robust,COMPLETE
157,0.6875029055009605,2025-03-18 11:41:03.287349,2025-03-18 11:42:07.760196,0 days 00:01:04.472847,30,MI,SGD,,Robust,COMPLETE
158,0.6679681756151743,2025-03-18 11:41:09.718774,2025-03-18 11:41:37.784214,0 days 00:00:28.065440,90,ANOVA,AB,ADASYN,Robust,COMPLETE
159,0.7193246674074238,2025-03-18 11:41:12.396889,2025-03-18 11:41:48.032992,0 days 00:00:35.636103,90,ANOVA,AB,,Robust,COMPLETE
160,0.6741883116882479,2025-03-18 11:41:13.382556,2025-03-18 11:41:40.376946,0 days 00:00:26.994390,90,ANOVA,AB,ADASYN,Robust,COMPLETE
161,0.7313283768289071,2025-03-18 11:41:13.649158,2025-03-18 11:42:13.006104,0 days 00:00:59.356946,90,ANOVA,DT,,Robust,COMPLETE
162,0.7368442445943069,2025-03-18 11:41:14.104957,2025-03-18 11:42:26.818269,0 days 00:01:12.713312,90,RFE,AB,,QT,COMPLETE
163,0.6661304179411259,2025-03-18 11:41:14.356126,2025-03-18 11:41:40.376946,0 days 00:00:26.020820,90,ANOVA,AB,ADASYN,Robust,COMPLETE
164,0.7550726908167582,2025-03-18 11:41:15.280481,2025-03-18 11:41:48.363659,0 days 00:00:33.083178,90,ANOVA,AB,,Robust,COMPLETE
165,0.7179237429239586,2025-03-18 11:41:16.316538,2025-03-18 11:41:48.363659,0 days 00:00:32.047121,90,ANOVA,AB,,Robust,COMPLETE
166,0.7270156926408877,2025-03-18 11:41:16.629422,2025-03-18 11:41:45.071780,0 days 00:00:28.442358,90,ANOVA,AB,,Robust,COMPLETE
167,0.73749962751048,2025-03-18 11:41:17.715583,2025-03-18 11:42:09.066012,0 days 00:00:51.350429,30,MI,SGD,,Robust,COMPLETE
168,0.7515185085945031,2025-03-18 11:41:18.187431,2025-03-18 11:42:37.390192,0 days 00:01:19.202761,90,RFE,AB,,Robust,COMPLETE
